-- MySQL dump 10.13  Distrib 8.0.42, for Win64 (x86_64)
--
-- Host: 127.0.0.1    Database: theflightshub.com.au
-- ------------------------------------------------------
-- Server version	8.0.42

/*!40101 SET @OLD_CHARACTER_SET_CLIENT=@@CHARACTER_SET_CLIENT */;
/*!40101 SET @OLD_CHARACTER_SET_RESULTS=@@CHARACTER_SET_RESULTS */;
/*!40101 SET @OLD_COLLATION_CONNECTION=@@COLLATION_CONNECTION */;
/*!50503 SET NAMES utf8 */;
/*!40103 SET @OLD_TIME_ZONE=@@TIME_ZONE */;
/*!40103 SET TIME_ZONE='+00:00' */;
/*!40014 SET @OLD_UNIQUE_CHECKS=@@UNIQUE_CHECKS, UNIQUE_CHECKS=0 */;
/*!40014 SET @OLD_FOREIGN_KEY_CHECKS=@@FOREIGN_KEY_CHECKS, FOREIGN_KEY_CHECKS=0 */;
/*!40101 SET @OLD_SQL_MODE=@@SQL_MODE, SQL_MODE='NO_AUTO_VALUE_ON_ZERO' */;
/*!40111 SET @OLD_SQL_NOTES=@@SQL_NOTES, SQL_NOTES=0 */;

--
-- Table structure for table `activities`
--

DROP TABLE IF EXISTS `activities`;
/*!40101 SET @saved_cs_client     = @@character_set_client */;
/*!50503 SET character_set_client = utf8mb4 */;
CREATE TABLE `activities` (
  `actvities_id` int NOT NULL AUTO_INCREMENT,
  `Activities_Name` varchar(255) COLLATE utf8mb4_general_ci NOT NULL,
  `Type` varchar(255) COLLATE utf8mb4_general_ci NOT NULL,
  `Add_Details` longtext COLLATE utf8mb4_general_ci NOT NULL,
  `image` varchar(255) COLLATE utf8mb4_general_ci NOT NULL,
  `status` int NOT NULL DEFAULT '1',
  PRIMARY KEY (`actvities_id`)
) ENGINE=InnoDB AUTO_INCREMENT=7 DEFAULT CHARSET=utf8mb4 COLLATE=utf8mb4_general_ci;
/*!40101 SET character_set_client = @saved_cs_client */;

--
-- Dumping data for table `activities`
--

LOCK TABLES `activities` WRITE;
/*!40000 ALTER TABLE `activities` DISABLE KEYS */;
/*!40000 ALTER TABLE `activities` ENABLE KEYS */;
UNLOCK TABLES;

--
-- Table structure for table `admin`
--

DROP TABLE IF EXISTS `admin`;
/*!40101 SET @saved_cs_client     = @@character_set_client */;
/*!50503 SET character_set_client = utf8mb4 */;
CREATE TABLE `admin` (
  `username` varchar(100) COLLATE utf8mb4_general_ci NOT NULL,
  `password` varchar(100) COLLATE utf8mb4_general_ci NOT NULL,
  `email` varchar(100) COLLATE utf8mb4_general_ci NOT NULL,
  `status` varchar(100) COLLATE utf8mb4_general_ci NOT NULL DEFAULT '1',
  `history` varchar(100) COLLATE utf8mb4_general_ci NOT NULL,
  `type` varchar(100) COLLATE utf8mb4_general_ci NOT NULL,
  `mobile` varchar(100) COLLATE utf8mb4_general_ci NOT NULL,
  `Staff_Email` varchar(200) COLLATE utf8mb4_general_ci NOT NULL,
  `activation_token` varchar(300) COLLATE utf8mb4_general_ci NOT NULL,
  `_id` int NOT NULL AUTO_INCREMENT,
  PRIMARY KEY (`_id`)
) ENGINE=InnoDB AUTO_INCREMENT=5 DEFAULT CHARSET=utf8mb4 COLLATE=utf8mb4_general_ci;
/*!40101 SET character_set_client = @saved_cs_client */;

--
-- Dumping data for table `admin`
--

LOCK TABLES `admin` WRITE;
/*!40000 ALTER TABLE `admin` DISABLE KEYS */;
INSERT INTO `admin` VALUES ('amit','9ab4b32c83f9412d5aec1f504e77904d','rakeshrai@gmail.com','1','09-16-2023 ','','9870443528','','d1b6788d68c8bc592489c7e2f5c5784c',1);
/*!40000 ALTER TABLE `admin` ENABLE KEYS */;
UNLOCK TABLES;

--
-- Table structure for table `admin_permissions`
--

DROP TABLE IF EXISTS `admin_permissions`;
/*!40101 SET @saved_cs_client     = @@character_set_client */;
/*!50503 SET character_set_client = utf8mb4 */;
CREATE TABLE `admin_permissions` (
  `_id` int NOT NULL AUTO_INCREMENT,
  `admin_id` int NOT NULL,
  `navigation_menu_id` int NOT NULL,
  PRIMARY KEY (`_id`)
) ENGINE=InnoDB AUTO_INCREMENT=35 DEFAULT CHARSET=utf8mb4 COLLATE=utf8mb4_general_ci;
/*!40101 SET character_set_client = @saved_cs_client */;

--
-- Dumping data for table `admin_permissions`
--

LOCK TABLES `admin_permissions` WRITE;
/*!40000 ALTER TABLE `admin_permissions` DISABLE KEYS */;
INSERT INTO `admin_permissions` VALUES (7,1,1),(8,2,2),(9,2,3),(10,2,4),(11,2,5),(12,2,1),(29,3,2),(33,3,16),(34,3,17);
/*!40000 ALTER TABLE `admin_permissions` ENABLE KEYS */;
UNLOCK TABLES;

--
-- Table structure for table `air_ticket`
--

DROP TABLE IF EXISTS `air_ticket`;
/*!40101 SET @saved_cs_client     = @@character_set_client */;
/*!50503 SET character_set_client = utf8mb4 */;
CREATE TABLE `air_ticket` (
  `air_ticket_id` int NOT NULL AUTO_INCREMENT,
  `ticket_form` varchar(255) COLLATE utf8mb4_general_ci NOT NULL,
  `ticket_to` varchar(255) COLLATE utf8mb4_general_ci NOT NULL,
  `ticket_journeydate` varchar(255) COLLATE utf8mb4_general_ci NOT NULL,
  `ticket_returndate` varchar(255) COLLATE utf8mb4_general_ci NOT NULL,
  `ticket_email` varchar(255) COLLATE utf8mb4_general_ci NOT NULL,
  `ticket_firstname` varchar(255) COLLATE utf8mb4_general_ci NOT NULL,
  `ticket_lastname` varchar(255) COLLATE utf8mb4_general_ci NOT NULL,
  `ticket_mobile` varchar(255) COLLATE utf8mb4_general_ci NOT NULL,
  `ticket_guestadult` varchar(255) COLLATE utf8mb4_general_ci NOT NULL,
  `ticket_guestchildren` varchar(255) COLLATE utf8mb4_general_ci NOT NULL,
  `ticket_cabinclass` varchar(255) COLLATE utf8mb4_general_ci NOT NULL,
  `booking_date` varchar(255) COLLATE utf8mb4_general_ci NOT NULL,
  `booking_time` varchar(255) COLLATE utf8mb4_general_ci NOT NULL,
  PRIMARY KEY (`air_ticket_id`)
) ENGINE=InnoDB AUTO_INCREMENT=479 DEFAULT CHARSET=utf8mb4 COLLATE=utf8mb4_general_ci;
/*!40101 SET character_set_client = @saved_cs_client */;

--
-- Dumping data for table `air_ticket`
--

LOCK TABLES `air_ticket` WRITE;
/*!40000 ALTER TABLE `air_ticket` DISABLE KEYS */;
INSERT INTO `air_ticket` VALUES (11,'Melbourne - Tullamarine','Kathmandu - Tribhuvan','2024-10-30','2024-11-25','oshinshahi0223@gmail.com','oshin','shahi','0411021525','1','0','Economy','',''),(12,'Brisbane','Hyderabad','2024-11-03','2024-12-13','vbk3106@gmail.com','Raghu','K','0493 123 393 ','3','1','Economy','',''),(13,'Melbourne - Tullamarine','Ahmedabad','2024-12-19','2025-01-17','sankipatel@gmail.com','Sanket','Patel','0475838935','2','0','Economy','',''),(14,'Melbourne - Tullamarine','Beirut','2024-12-22','2025-01-19','moussa_v97@hotmail.com','Vanessa','Nicolas','0424013088','3','0','Economy','',''),(15,'Adelaide','Denpasar/Bali','2024-11-15','2024-11-23','mdkamaluddintalukder47787@gmail.com','Md Kamal uddin ','Talukder ','013166840559','1','0','Economy','',''),(16,'Gold Coast','Sydney - Kingsford Smith','2024-09-13','2024-09-15','dipeshlamichhane84@gmail.com','Dipesh','Lamichhane','0423131927','5','0','Economy','',''),(17,'Melbourne - Tullamarine','Delhi, Indira Gandhi','2024-12-08','2024-12-30','akash.dhawan843@gmail.com','ANIL','KUMAR','0451521445','1','0','Economy','',''),(18,'Sydney - Kingsford Smith','Dhaka','2025-02-03','2025-02-15','mhrobi@hotmail.com','Mozammel','Hossain','0423960003','1','0','Economy','',''),(20,'Sydney - Kingsford Smith','Kathmandu - Tribhuvan','2024-10-01','2024-11-01','r.rashmi.chaulagain@gmail.com','Rashmi','Chaulagain ','0452618759','1','0','Economy','',''),(22,'Brisbane','Palermo - Punta Raisi','2025-04-23','2025-05-27','filross@hotmail.com','fil','ross','0413209169','2','0','Premium Economy','',''),(27,'Darwin','Gold Coast','2024-09-11','','oceanview.198643@icloud.com','Crystale ','Taylor ','0475073891','1','0','Economy','',''),(28,'Darwin','Gold Coast','2024-09-11','','oceanview.198643@icloud.com','Crystale ','Taylor ','0475073891','1','0','Economy','',''),(29,'Darwin','Gold Coast','2024-09-11','','oceanview.198643@icloud.com','Crystale ','Taylor ','0475073891','1','0','Economy','',''),(30,'Nadi','Sydney - Kingsford Smith','2024-10-08','','prinit0419@gmail.com','Priya sadhana','Devi','0492901325','1','0','Economy','',''),(77,'Sydney - Kingsford Smith','Islamabad - Islamabad Int&#039;l','2024-11-25','','ahmadowais149@gmail.com','Owais','Ahmad','0405924156','1','0','Economy','11-09-2024',''),(82,'Adelaide','Mackay','2025-07-01','2024-09-17','petermaxwellgraham@yahoo.com.au','Peter ','Graham ','O407651134 ','2','0','Economy','12-09-2024',''),(83,'Sydney - Kingsford Smith','Dhaka','2024-12-26','2025-01-26','alnahianaronno@gmail.com','Al Nahian','aronno','0424892803','1','0','Economy','13-09-2024',''),(84,'Abadan','Abu Dhabi','2024-09-28','2024-09-28','diwakarrai2004@gmail.com','rai','diwakar','555555','1','0','Premium Economy','14-09-2024','2024-11-14 00:33:27'),(85,'Brisbane','Manila - Ninoy Aquino Int&#039;l','2024-12-19','2025-02-01','jakemorandante1989@gmail.com','Jake','Morandante','0457889693','1','0','Economy','14-09-2024','2024-09-14 07:57:31'),(86,'Kuwait - Kuwait Int&#039;l','Cochin','2024-09-19','2024-10-05','bindhuroykwt@gmail.com','Bindhu','Issac','66539084','1','0','Economy','15-09-2024','2024-09-15 04:46:56'),(87,'Sydney - Kingsford Smith','London','2025-06-27','2025-08-15','gaildemasi1@gmail.com','Gail','Demasi','0416171751','2','0','Business','15-09-2024','2024-09-15 12:33:21'),(88,'Melbourne - Tullamarine','Denpasar/Bali','2025-03-10','2025-03-20','trebilcockmatt1@gmail.com','Matt','T','000111444','1','0','Economy','15-09-2024','2024-09-15 13:43:12'),(89,'Bangkok','Sydney - Kingsford Smith','2024-10-22','','adamjaf63@hotmail.com','Adam','Jaf','0403264070','1','0','Economy','15-09-2024','2024-09-15 17:55:50'),(91,'Brisbane','Cebu','2024-09-29','2024-10-16','sphygmo2013@gmail.com','gina','ibones','0450695620','1','0','Economy','16-09-2024','2024-09-16 10:08:04'),(92,'Brisbane','Bundaberg','2024-09-17','2024-09-18','shanzsirrell@gmail.com','Shannon','Sirrell','+61438203813','1','0','Economy','16-09-2024','2024-09-16 15:15:59'),(93,'Ahmedabad','Sydney - Kingsford Smith','2024-09-27','','rajbhatt2210@gmail.com','Rajendrakumar','Bhatt','0469871405','1','0','Economy','16-09-2024','2024-09-16 16:25:06'),(96,'Sydney - Kingsford Smith','Dhaka','2024-09-28','2024-10-04','manirtz@yahoo.com','Manir','Zaman','0423093244','1','0','Economy','17-09-2024','2024-09-17 08:03:09'),(97,'Melbourne - Tullamarine','Sydney - Kingsford Smith','2024-09-27','2024-09-30','405244914@qq.com','Zuo','Lei ','0421298508','2','0','Economy','17-09-2024','2024-09-17 12:45:55'),(100,'Brisbane','Manchester','2025-08-13','2025-09-10','Jilliancarey1946@yahoo.com','Jilliancarey1946@yahoo.com ','Carey ','0406195426','1','0','Economy','18-09-2024','2024-09-18 12:07:34'),(101,'Melbourne - Tullamarine','Indianapolis, IN','2024-10-26','2025-02-22','pvn.kamboj@gmail.com','Praveen','Kumar','7895369474','1','0','Economy','18-09-2024','2024-09-18 14:18:07'),(103,'Sydney - Kingsford Smith','Entebbe','2024-12-25','2025-01-29','brenda_nanyanzi@yahoo.com','Ruth','Mukuye','0449 295 490','1','0','Economy','19-09-2024','2024-09-19 07:06:46'),(104,'Calcutta (Kolkata) - Netaji Subhas Chandra','Sydney - Kingsford Smith','2024-11-11','','SANDIP.GUHA18@GMAIL.COM','SANDIP','GUHA','7980431208','1','0','Economy','19-09-2024','2024-09-19 13:24:46'),(105,'Melbourne - Tullamarine','Denpasar/Bali','2024-09-27','2024-10-03','Roongthipkamchat524@gmail.com','Roongthip ','Kamchat ','61476992538','1','0','Economy','21-09-2024','2024-09-21 03:35:29'),(107,'Brisbane','London - Gatwick','2025-05-02','2025-07-10','Jcortie@hotmail.com','John','Cortie ','0484597651','2','0','Premium Economy','22-09-2024','2024-09-22 11:07:46'),(108,'Sydney - Kingsford Smith','Dubai','2024-10-10','2024-10-31','bir@gmail.com','Bir','Monga','657112908','1','0','Economy','23-09-2024','2024-09-24 00:06:17'),(109,'New York, NY','Lagos - Murtala Muhammed','2024-10-04','2024-10-26','bir@gmail.com','Bir','Monga','786566889','1','0','Economy','24-09-2024','2024-09-24 00:06:17'),(110,'Palmerston North','Colombo','2025-01-04','2025-02-07','saumya.warna@gmail.com','Saumya','Warnakulasuriya','02108420261','1','0','Economy','24-09-2024','2024-09-24 08:30:32'),(111,'Sydney - Kingsford Smith','Brisbane','2024-10-27','2024-11-03','pandon@tpg.com.au','Tina','Pandoulis','O433061350','4','0','Economy','26-09-2024','2024-09-26 11:09:07'),(112,'Sydney - Kingsford Smith','Bombay','2025-04-11','2025-05-15','rebeccadsouza88@gmail.com','Rebecca','D&#039;Souza','0400835584','2','0','Economy','27-09-2024','2024-09-27 18:05:03'),(113,'','Brisbane','2024-10-25','2024-10-28','jmpisters@bigpond.com','Joe','Pisters','0421025900','1','0','Economy','29-09-2024','2024-09-29 16:49:17'),(114,'Accra','Amsterdam, Schiphol','2024-10-02','2024-10-17','ramlife60@gmail.com','Eric ','Amankwah','3032129867','1','0','Economy','01-10-2024','2024-10-01 06:09:43'),(115,'Melbourne, FL','Sydney - Kingsford Smith','2024-10-05','2024-10-07','mick120956@yahoo.com.au','Michael','Moon','0481199083','2','0','Economy','01-10-2024','2024-10-01 17:34:12'),(116,'Melbourne - Tullamarine','Colombo','2024-12-21','2025-02-12','kantha.mahindadasa@gmail.com','Kantha ','Mhindadasa','0402910007','2','1','Economy','03-10-2024','2024-10-03 13:17:07'),(117,'Melbourne - Tullamarine','Denpasar/Bali','2024-11-01','2024-11-30','sharnanemovski7@gmail.com','Sharna','Nemovski','0413687855','2','0','Economy','04-10-2024','2024-10-04 04:53:06'),(118,'Sydney - Kingsford Smith','Kathmandu - Tribhuvan','2024-10-23','2024-11-30','alisha2004adhikari@gmail.com','Alisha','Adhikari','0406219300','1','0','Economy','04-10-2024','2024-10-04 10:32:15'),(119,'Sydney - Kingsford Smith','Bangalore','2025-04-18','2025-05-16','ab.au@hotmail.com','Kalpana ','Fulambarkar ','0426966631','1','0','Economy','04-10-2024','2024-10-04 12:02:57'),(120,'Melbourne - Tullamarine','Brisbane','2024-10-25','','lizholloway1947@gmail.com','Elizabeth ','Holloway ','0401804730','2','0','Economy','04-10-2024','2024-10-04 12:15:59'),(121,'Melbourne, FL','Sydney - Kingsford Smith','2024-10-19','2024-10-30','sakshisharma30777@gmail.com','sakshi','sharma','9988776655','2','0','Economy','04-10-2024','2024-10-30 00:25:05'),(123,'Melbourne - Tullamarine','Sydney - Kingsford Smith','2024-11-01','','patsy.lange@yahoo.com','Patsy','Lange','0426291896','2','0','Economy','09-10-2024','2024-10-09 08:47:54'),(124,'Brisbane','Kathmandu - Tribhuvan','2024-11-29','2024-12-23','paudyal@usq.edu.au','Dev','Paudyal','0405848065','1','0','Economy','09-10-2024','2024-10-09 09:35:26'),(125,'Melbourne - Tullamarine','','2025-01-03','2024-10-11','sanger018@hotmail.com','Sandra','Gerritsen ','0428789294','1','0','Economy','09-10-2024','2024-10-09 14:22:52'),(126,'Perth Int&#039;l','Johannesburg','2024-10-10','','nunuoconnor@gmail.com','Elizabeth','O&#039;Connor','+27825086355','1','0','Economy','10-10-2024','2024-10-10 07:17:19'),(127,'Melbourne - Tullamarine','Paris','2025-03-12','2024-10-30','lizziepringle@hotmail.com','Elizabeth ','Pringle ','0422237174','1','0','Economy','10-10-2024','2024-10-10 15:22:59'),(128,'Delhi, Indira Gandhi','Sydney - Kingsford Smith','2025-03-03','2025-05-31','rree@dddd.com','Res','Bas','0432323232','1','0','Economy','11-10-2024','2024-10-11 17:29:57'),(129,'Townsville','Cochin','2024-11-29','2025-01-13','skpillai82@gmail.com','SUMESH','PILLAI','0457205020','1','0','Economy','12-10-2024','2024-10-12 17:08:49'),(130,'Adelaide','Colombo','2025-12-13','2026-01-06','wsineth@hotmail.com','Sineth','Wijesekara','0428909865','3','0','Economy','12-10-2024','2024-10-12 23:48:06'),(131,'Melbourne - Tullamarine','Colombo','2024-12-20','2025-01-12','kevindilan33@gmail.com','Kevin','Selvaraja','076 810 4964','1','0','Economy','14-10-2024','2024-10-14 13:38:51'),(132,'Colombo','Sydney - Kingsford Smith','2024-10-28','2025-10-13','dilani_mr@yahoo.com','Marina','Maheswaran','0450451065','2','0','Economy','17-10-2024','2024-10-17 11:55:12'),(134,'Sydney - Kingsford Smith','Istanbul - Ataturk','2025-01-30','2025-05-29','city.cement.rendering@hotmail.com','Erdeniz','Kahraman','0415243156','1','0','Economy','18-10-2024','2024-10-18 16:28:33'),(135,'Melbourne, FL','Bangkok','2024-11-23','2024-12-07','tewM01165@gmail.com','Thoshitha','Weerasinghe','0450060029','4','0','Economy','18-10-2024','2024-10-18 20:39:56'),(136,'Entebbe','Sharjah','2024-11-12','2024-12-12','bikorwav@gmail.com','Bikorwa','Vicent','+256700954321','1','0','Economy','21-10-2024','2024-10-21 10:21:52'),(137,'Adelaide','Hyderabad - Begumpet','2025-07-01','2025-09-05','nehaf89@gmail.com','Sneha Rani','Sulake','0470647641','2','2','Economy','21-10-2024','2024-10-21 20:08:28'),(138,'Indianapolis, IN','Indianapolis, IN','2024-10-22','2024-10-31','dalip@vibrantick.in','Dalip','Sethi','9592806527','1','0','Economy','21-10-2024','2024-11-13 23:38:00'),(139,'Melbourne - Tullamarine','Delhi, Indira Gandhi','2024-12-20','2025-01-11','mehakhanda.12@gmail.com','Mehak','Handa','+61475637126','1','0','Economy','21-10-2024','2024-10-21 21:18:48'),(140,'Sydney - Kingsford Smith','Delhi, Indira Gandhi','2024-10-27','2024-11-10','romiagarwal4@gmail.com','Romi','Agar','0425321900','1','0','Economy','21-10-2024','2024-10-21 23:21:08'),(143,'Adelaide','Melbourne, FL','2024-10-24','2024-10-31','sakshisharma30777@gmail.com','sakshi','sharma','9988776655','2','0','Premium Economy','23-10-2024','2024-10-30 00:25:05'),(144,'Aarhus','Abeche','2024-10-24','2024-10-30','sakshisharma30777@gmail.com','sakshi','sharma','9988776655','3','0','Economy','23-10-2024','2024-10-30 00:25:05'),(145,'Adler/Sochi','Aden','2024-11-22','2024-11-30','dt4542475@gmail.com','Kushi','Thakur','9988774435','1','0','Economy','23-10-2024','2024-10-24 23:08:49'),(146,'Sydney - Kingsford Smith','Ahmedabad','2025-09-21','2024-11-02','pchandresh@yahoo.com','Chandrakant','Panchal','0422089955','1','0','Economy','24-10-2024','2024-10-24 13:16:43'),(147,'Abadan','Annaba','2024-11-12','2024-11-15','dt4542475@gmail.com','Kushi','Thakur','8877665532','1','0','Economy','24-10-2024','2024-10-24 23:08:49'),(148,'Melbourne - Tullamarine','Delhi, Indira Gandhi','2024-11-28','2024-12-15','bhardwaj.roshini1987@gmail.com','Archana','Bhardwaj','0479 156 587 ','1','0','Economy','25-10-2024','2024-10-25 00:07:12'),(149,'Melbourne - Tullamarine','Colombo','2024-12-20','2025-01-03','keshansilva1999@gmail.com','Keshan ','Silva','0466929454','1','0','Economy','25-10-2024','2024-10-25 08:25:39'),(150,'Melbourne - Tullamarine','Delhi, Indira Gandhi','2024-12-22','2025-01-08','rajanjoshi38@yahoo.com','saveena ','joshi ','0490 074 700 ','1','0','Economy','25-10-2024','2024-10-25 18:58:19'),(151,'Melbourne - Tullamarine','Delhi, Indira Gandhi','2024-12-09','2025-01-20','anandkataria1111@gmail.com','Anand','Kataria','0450355977','1','0','Economy','26-10-2024','2024-10-26 14:26:06'),(152,'Melbourne - Tullamarine','Colombo','2024-12-19','2025-01-07','marlank.3333@gmail.com','Marlan','Keerthirathne','0439958379','1','0','Economy','27-10-2024','2024-10-27 12:50:53'),(153,'Melbourne - Tullamarine','Darwin','2024-11-05','2024-11-12','glendalewis1956@icloud.com','Gary','Lewis ','0412745510','1','0','Economy','27-10-2024','2024-10-27 15:35:30'),(154,'Jakarta - Soekarno-Hatta','Incheon, Incheon Int&#039;l Airport','2024-10-27','','ranggaditya988@gmail.com','Suria','Nika','082232056280','1','0','Economy','27-10-2024','2024-10-27 15:59:59'),(155,'Brisbane','Sydney - Kingsford Smith','2024-11-30','','Baumann271037@gmail.com','Charlene ','Grace ','0481 587 937text only','1','0','Business','28-10-2024','2024-10-28 20:56:16'),(157,'Perth Int&#039;l','Vancouver - Vancouver Int&#039;l','2025-03-31','2025-04-17','hermzandman@gmail.com','Herm','Zandman','0410585095','2','0','Economy','29-10-2024','2024-10-29 21:36:42'),(168,'Colombo','Melbourne - Tullamarine','2025-01-06','2025-04-06','nmnb@bv.ghg','gfhgf','hgf','041521611622','1','0','Economy','31-10-2024','2024-10-31 00:56:42'),(169,'Colombo','Melbourne - Tullamarine','2025-01-06','2025-04-06','nmnb@bv.ghg','gfhgf','hgf','041521611622','1','0','Economy','31-10-2024','2024-10-31 00:56:42'),(170,'Kathmandu - Tribhuvan','Sydney - Kingsford Smith','2024-11-15','2024-12-11','joshanpokharel08@gmail.com','Joshan','Pokharel','0430361537','1','0','Economy','31-10-2024','2024-10-31 18:18:32'),(171,'Kathmandu - Tribhuvan','Sydney - Kingsford Smith','2024-11-15','2024-12-11','joshanpokharel08@gmail.com','Joshan','Pokharel','0430361537','1','0','Economy','31-10-2024','2024-10-31 18:18:32'),(172,'Adelaide','Denpasar/Bali','2025-02-28','2025-03-03','engakita@gmail.com','Ngakita ','Taurima ','0435222202','1','0','Economy','01-11-2024','2024-11-01 17:29:32'),(173,'Adelaide','Denpasar/Bali','2025-02-28','2025-03-03','engakita@gmail.com','Ngakita ','Taurima ','0435222202','1','0','Economy','01-11-2024','2024-11-01 17:29:32'),(174,'Sydney - Kingsford Smith','Denpasar/Bali','2024-12-02','2024-11-09','Tesospider10@gmail.com','Sylvana','Tesoriero','O457783781','1','0','Economy','02-11-2024','2024-11-02 14:40:18'),(175,'Sydney - Kingsford Smith','Denpasar/Bali','2024-12-02','2024-11-09','Tesospider10@gmail.com','Sylvana','Tesoriero','O457783781','1','0','Economy','02-11-2024','2024-11-02 14:40:18'),(176,'Albury','Brisbane','2024-12-23','2025-01-03','marvinjakemaglalang16@gmail.com','marvin','maglalang','0498668922','1','0','Economy','02-11-2024','2024-11-02 20:49:21'),(177,'Albury','Brisbane','2024-12-23','2025-01-03','marvinjakemaglalang16@gmail.com','marvin','maglalang','0498668922','1','0','Economy','02-11-2024','2024-11-02 20:49:21'),(178,'Delhi, Indira Gandhi','','2024-11-26','2025-03-26','kewaldhareula@gmail.com','Kewal Ram ','Dhareula ','9816463938','1','0','Economy','02-11-2024','2024-11-02 23:55:37'),(179,'Delhi, Indira Gandhi','','2024-11-26','2025-03-26','kewaldhareula@gmail.com','Kewal Ram ','Dhareula ','9816463938','1','0','Economy','02-11-2024','2024-11-02 23:55:37'),(180,'Brisbane','Portland Int&#039;l, OR','2024-12-14','2024-12-22','chandarlautoka@gmail.com','Chandar','Dutt','0412120186','1','0','Economy','03-11-2024','2024-11-03 03:36:56'),(184,'Sydney - Kingsford Smith','Denpasar/Bali','2024-11-04','2024-11-11','smissib@gmail.com','Bernadette','Salmon','0406307006','2','0','Economy','03-11-2024','2024-11-03 16:24:59'),(186,'Sydney - Kingsford Smith','Adelaide','2024-11-26','2024-11-28','mail2irenosa@yahoo.com','Irene','Ekeneza','0432110693','1','0','Economy','03-11-2024','2024-11-03 17:03:17'),(187,'Sydney - Kingsford Smith','Adelaide','2024-11-26','2024-11-28','mail2irenosa@yahoo.com','Irene','Ekeneza','0432110693','1','0','Economy','03-11-2024','2024-11-03 17:03:17'),(188,'Sydney - Kingsford Smith','Brisbane','2024-11-09','2024-11-09','bassamir29@gmail.com','Sam','Samir','0475419379','1','0','Economy','03-11-2024','2024-11-03 18:29:04'),(189,'Sydney - Kingsford Smith','Brisbane','2024-11-09','2024-11-09','bassamir29@gmail.com','Sam','Samir','0475419379','1','0','Economy','03-11-2024','2024-11-03 18:29:04'),(190,'Brisbane','Townsville','2024-11-29','2024-12-01','herbie99@hotmail.com','Vanessa ','Herbert','0402101262','1','0','Economy','03-11-2024','2024-11-03 19:27:39'),(196,'Sydney - Kingsford Smith','Kathmandu - Tribhuvan','2025-03-28','2025-05-03','lalita_oli@yahoo.com','Lalita','Chhetri','0405343545','1','0','Economy','04-11-2024','2024-11-04 11:54:27'),(197,'Sydney - Kingsford Smith','Kathmandu - Tribhuvan','2025-03-28','2025-05-03','lalita_oli@yahoo.com','Lalita','Chhetri','0405343545','1','0','Economy','04-11-2024','2024-11-04 11:54:27'),(198,'Sydney - Kingsford Smith','Brisbane','2024-11-20','2024-12-11','rhysmarnell883@gmail.com','Rhys','Marnell-Insley','0491034384','1','0','Economy','04-11-2024','2024-11-04 18:21:58'),(199,'Sydney - Kingsford Smith','Brisbane','2024-11-20','2024-12-11','rhysmarnell883@gmail.com','Rhys','Marnell-Insley','0491034384','1','0','Economy','04-11-2024','2024-11-04 18:21:58'),(200,'Sydney - Kingsford Smith','Melbourne - Tullamarine','2024-11-05','2024-11-07','ravinderjeetsingh2000@gmail.com','RAVINDERJEET','SINGH','0466652153','1','0','Economy','04-11-2024','2024-11-04 18:33:32'),(201,'Sydney - Kingsford Smith','Melbourne - Tullamarine','2024-11-05','2024-11-07','ravinderjeetsingh2000@gmail.com','RAVINDERJEET','SINGH','0466652153','1','0','Economy','04-11-2024','2024-11-04 18:33:32'),(202,'Perth Int&#039;l','Kathmandu - Tribhuvan','2024-12-20','2025-01-12','dneskarki8822@gmail.com','Dinesh','Chhetri','0424869991','1','0','Economy','04-11-2024','2024-11-04 18:56:17'),(203,'Perth Int&#039;l','Kathmandu - Tribhuvan','2024-12-20','2025-01-12','dneskarki8822@gmail.com','Dinesh','Chhetri','0424869991','1','0','Economy','04-11-2024','2024-11-04 18:56:17'),(204,'Perth Int&#039;l','Denpasar/Bali','2025-02-26','2024-12-02','elle.aaa7@gmail.com','Elle','Allister','0421960512','1','0','Economy','04-11-2024','2024-11-04 21:17:47'),(205,'Perth Int&#039;l','Denpasar/Bali','2025-02-26','2024-12-02','elle.aaa7@gmail.com','Elle','Allister','0421960512','1','0','Economy','04-11-2024','2024-11-04 21:17:47'),(208,'Kathmandu - Tribhuvan','Melbourne - Tullamarine','2024-11-07','','ashishgairhe1@gmail.com','Ashish','Gairhe','0452 460 052','1','0','Economy','05-11-2024','2024-11-05 01:27:27'),(209,'Melbourne - Tullamarine','Hyderabad - Begumpet','2024-12-21','2025-01-11','mnandu37@gmail.com','Mahesh','Bejawada','0449923416','1','0','Economy','06-11-2024','2024-11-06 12:44:36'),(210,'','Melbourne, FL','2024-11-07','2024-11-11','everythingallthetime7070@gmail.com','Stacey ','Stacey banfield ','0478619052','1','0','Economy','06-11-2024','2024-11-06 21:29:04'),(211,'Melbourne - Tullamarine','Colombo','2025-04-19','2025-05-03','dilinichami@yahoo.com','dilini','weerathunga','0447069440','1','0','Economy','07-11-2024','2024-11-07 00:00:39'),(212,'Adelaide','Shanghai - Pu Dong','2024-11-14','2024-11-28','homayoun_ajdari@yahoo.com.au','Homayoun','Ajdari','0431133130','1','0','Economy','07-11-2024','2024-11-07 15:41:04'),(213,'Kathmandu - Tribhuvan','Sydney - Kingsford Smith','2025-02-02','2025-02-28','kcbpin11@gmail.com','Bipin','K C','0426970026','1','0','Economy','08-11-2024','2024-11-08 20:31:23'),(214,'Sydney - Kingsford Smith','Kuala Lumpur - Int&#039;l Airport','2024-12-16','2025-01-10','ss@gmail.com','S','S','405684234','1','0','Economy','10-11-2024','2024-11-10 14:26:02'),(215,'Brisbane','Rockhampton','2024-11-13','','ochinkupuru@gmail.com','Bianca ','Conlon','0461366589','1','0','Economy','11-11-2024','2024-11-11 11:51:14'),(216,'Coffs Harbour','Brisbane','2024-11-28','','scottstoker299@gmail.com','Scott','Stoker','0479032511','1','0','Economy','12-11-2024','2024-11-12 10:12:41'),(217,'Canberra','Melbourne - Tullamarine','2024-11-20','2024-11-23','paul.curtis1977@gmail.com','Paul','Curtis ','0475 128 364 ','1','0','Economy','12-11-2024','2024-11-12 10:27:45'),(218,'Sydney - Kingsford Smith','Colombo','2025-04-10','2024-11-28','anuradhakodithuwakku@gmail.com','Anuradha','Kodithuwakku','486042004','4','0','Economy','12-11-2024','2024-11-12 15:17:43'),(219,'Sydney - Kingsford Smith','Melbourne - Tullamarine','2024-11-13','','mpkmartina@gmail.com','Martina','Perusko','420822556','1','0','Economy','12-11-2024','2024-11-12 15:19:14'),(220,'Sydney - Kingsford Smith','Melbourne - Tullamarine','2024-11-13','','jaydevdion00@gmail.com','Alexandrina','CAPATINA','0423752878','1','0','Economy','12-11-2024','2024-11-12 15:35:09'),(221,'Melbourne - Tullamarine','Colombo','2025-06-19','2025-07-18','lasantha7@hotmail.com','lasantha','mahesh','0419448572','3','2','Economy','13-11-2024','2024-11-13 02:39:41'),(226,'Aarhus','Aberdeen, SD','2024-11-13','2024-11-21','ydeep9073@gmail.com','TEST','TEST','23423','1','0','Business','14-11-2024','2025-01-29 01:54:53'),(227,'Adelaide','Melbourne, FL','2024-11-21','2024-11-23','joykem64@gmail.com','Joyline','kemboi','0424597318','1','0','Economy','14-11-2024','2024-11-14 13:44:25'),(228,'Brisbane','Apia','2024-12-23','2025-01-12','teonopotoru@gmail.com','Teono ','Potoru ','0412020336','1','0','Economy','14-11-2024','2024-11-14 15:31:38'),(229,'Perth Int&#039;l','','2025-01-31','2025-03-15','davidkasitu@gmail.com','David','Kasitu ','0491190627','1','0','Economy','15-11-2024','2024-11-15 20:18:33'),(230,'','','2024-11-22','','matthewmabior2015@gmail.com','Matthew','Mabior','0402488584','1','0','Economy','18-11-2024','2024-11-18 19:43:57'),(231,'Perth Int&#039;l','Ahmedabad','2025-01-23','2025-02-10','ch@yahoo.com','Ch','Tar','0432123878','1','0','Economy','18-11-2024','2024-11-18 20:03:16'),(232,'Melbourne - Tullamarine','Delhi, Indira Gandhi','2024-12-25','2025-01-26','sha0041@gmail.com','Anushka','Sharma','0491164855','1','0','Economy','18-11-2024','2024-11-18 20:03:22'),(234,'Melbourne - Tullamarine','Ahmedabad','2025-12-01','2026-02-01','nisha_barot2000@yahoo.com','Nisha','Barot','0432 293 132','3','0','Economy','19-11-2024','2024-11-19 08:08:25'),(235,'Brisbane','Nadi','2024-12-12','2025-01-07','almadinahinvestmentsfiji@gmail.com','Mohammed ','Khan','0456 818 061 ','1','0','Economy','19-11-2024','2024-11-19 14:33:15'),(236,'Kathmandu - Tribhuvan','Sydney - Kingsford Smith','2024-12-22','','pmorony@gmail.com','Peter','Morony','0478 224 885','1','0','Economy','22-11-2024','2024-11-22 19:31:35'),(237,'Melbourne, FL','Colombo','2025-07-10','2025-08-15','achifreezer112@gmail.com','Achintha Madusha','Jayaratne','0404116297','1','0','Economy','27-11-2024','2024-11-27 12:02:33'),(238,'Melbourne - Tullamarine','Delhi, Indira Gandhi','2024-11-28','','parveshrana3214@gmail.com','Vishal','Rana','0469788145','1','0','Economy','28-11-2024','2024-11-28 18:15:24'),(239,'Melbourne - Tullamarine','','2024-12-12','','ilancohen913@gmail.com','Ilan','Cohen','0433 8 18618 ','1','0','Economy','29-11-2024','2024-11-29 16:59:17'),(240,'Canberra','Delhi, Indira Gandhi','2025-01-05','2025-01-21','yogeshkashyap@hotmail.com','Yogesh','Kashyap','417490314','2','0','Economy','30-11-2024','2024-11-30 19:27:25'),(241,'Sydney - Kingsford Smith','Nadi','2024-12-28','2025-01-26','timociravulo@gmail.com','Timoci ','Ravulo','+61 414 155 471','1','0','Economy','01-12-2024','2024-12-01 16:59:44'),(242,'Melbourne, FL','Delhi, Indira Gandhi','2024-12-04','2024-12-11','yesveer@yahoo.com','JASVEER SINGH','Thind','0474901954','1','0','Economy','02-12-2024','2024-12-02 21:37:37'),(243,'Sydney - Kingsford Smith','Auckland','2025-01-11','2024-12-20','humrazafghan@yahoo.com','Ahmad','Noori','0488694778','2','1','Economy','04-12-2024','2024-12-04 14:15:54'),(244,'Brisbane','Colombo','2024-12-17','2024-12-26','poosaranga@gmail.com','Saranga','Kalalpitiya','0430395767','1','0','Economy','04-12-2024','2024-12-04 15:29:39'),(245,'Melbourne - Tullamarine','Delhi, Indira Gandhi','2025-01-06','2025-01-28','aman.arora.melb@gmail.com','Aman','Arora','0430597780','3','1','Economy','04-12-2024','2024-12-04 15:58:48'),(246,'Melbourne - Tullamarine','Hyderabad - Begumpet','2025-01-22','2025-03-12','vslakshmi.dwarampudi@gmail.com','Venkata','d','0424891389','2','0','Economy','05-12-2024','2024-12-05 21:31:13'),(247,'Melbourne, FL','Colombo','2025-01-02','2024-12-18','shashinifernando53@gmail.com','Shashini','Fernando','0740983180','1','0','Economy','05-12-2024','2024-12-05 21:51:42'),(248,'Melbourne - Tullamarine','Colombo','2025-02-02','2025-03-07','desilva39@hotmail.com','Lindamulage Marius','De Silva Wijeyeratne','0432398055','1','0','Economy','06-12-2024','2024-12-06 14:02:26'),(249,'Perth Int&#039;l','Port Hedland','2024-12-09','2025-03-20','kellyninyette88@gmail.com','Nicholas ','Narrier','401856736','1','0','Economy','08-12-2024','2024-12-08 17:33:04'),(250,'Melbourne - Tullamarine','Delhi, Indira Gandhi','2025-02-11','2025-05-02','kuldipkaur1359@gmail.com','Kuldip','Kaur','433753811','1','0','Economy','11-12-2024','2024-12-11 13:14:01'),(251,'Melbourne - Tullamarine','Denpasar/Bali','2024-12-24','2024-12-30','skilioba@yahoo.com','Stephanie ','Kilioba ','0474733140','3','0','Economy','12-12-2024','2024-12-12 09:09:12'),(252,'Melbourne - Tullamarine','Colombo','2025-01-31','2025-02-10','prasannaw2011@gmail.com','Prasanna ','Wickramatunge','0413039320','1','0','Economy','13-12-2024','2024-12-13 16:59:13'),(253,'Brisbane','Bangalore','2025-02-04','2025-02-18','priya_bhindi@hotmail.com','Priya','RANIGA','0406 730 411','4','0','Economy','14-12-2024','2024-12-14 20:36:52'),(254,'Brisbane','Delhi, Indira Gandhi','2025-02-01','2025-03-07','min@hotmail.com','Simran','Singh','0403654789','2','0','Economy','15-12-2024','2024-12-15 22:29:57'),(255,'Delhi, Indira Gandhi','Brisbane','2025-01-06','','rai.arveen10@gmail.com','Arveen','Rai','40670323','1','0','Economy','16-12-2024','2024-12-16 00:57:13'),(256,'Brisbane','Chiang Mai','2025-01-10','2025-01-31','rj_werner@hotmail.com','Rob','Werner','0431503673','1','0','Economy','16-12-2024','2024-12-16 16:36:00'),(257,'Melbourne - Tullamarine','Sydney - Kingsford Smith','2024-12-20','','Craigjanice47@gmail.com','Janice','Craig','472982482','1','0','Economy','16-12-2024','2024-12-16 17:27:40'),(258,'Sydney - Kingsford Smith','Tamworth','2024-12-22','2025-01-07','mumtazatnz@gmail.com','MUMTAZ','Khan','212607368','2','0','Economy','16-12-2024','2024-12-16 20:04:31'),(259,'Brisbane','Denpasar/Bali','2025-09-02','2025-09-08','rhmeyer40@yahoo.com','Richard','Meyer','410576209','2','0','Economy','16-12-2024','2024-12-16 20:47:14'),(260,'Delhi, Indira Gandhi','Brisbane','2025-01-06','','rai.arveen@gmail.com','Arveen','Rai','040','1','0','Economy','16-12-2024','2024-12-16 21:10:35'),(261,'Brisbane','Mackay','2024-12-21','','dbinsiar@gmail.com','Dwayne ','Binsiar ','0421882312','1','0','Economy','20-12-2024','2024-12-20 15:32:14'),(262,'Delhi, Indira Gandhi','Sydney - Kingsford Smith','2024-12-24','','deepkuldeep817@gmail.com','Kuldeep','Kaur','0404355493','1','0','Economy','21-12-2024','2024-12-21 00:12:03'),(263,'Melbourne - Tullamarine','Devonport','2025-02-28','2025-03-03','arthur.lane@gmail.com','Arthur ','Lane ','0438 848 522 ','1','0','Economy','21-12-2024','2024-12-21 12:59:37'),(264,'Sydney - Kingsford Smith','Kochi','2025-10-03','2025-10-24','geothokar@yahoo.com','George','Thomas','0422261210','2','0','Economy','23-12-2024','2024-12-23 11:50:28'),(265,'Melbourne - Tullamarine','Ahmedabad','2025-02-01','2025-02-22','offparin@neko2.net','Deep','Gurnani','47032095','1','0','Economy','24-12-2024','2024-12-24 19:20:51'),(266,'Melbourne, FL','Damascus, International','2025-03-01','','moeyalhomsi@gmail.com','Mohammad','Al homsi','0412008345','3','0','Economy','24-12-2024','2024-12-24 22:34:04'),(267,'Melbourne - Tullamarine','Hyderabad','2025-01-09','2025-02-13','kingbostonxx@gmail.com','Chintu','China','0435 892 019','1','0','Economy','25-12-2024','2024-12-25 18:00:41'),(268,'Sydney - Kingsford Smith','Delhi, Indira Gandhi','2025-02-12','2025-03-21','pathtoupliftment@gmail.com','Sarah','S','0433015631','2','0','Economy','26-12-2024','2024-12-26 19:11:52'),(269,'Chicago O&#039;Hare Int&#039;l Airport, IL','Brisbane','2025-04-14','2025-04-28','name@company.com','joe','smith','5559999','2','0','Business','27-12-2024','2024-12-27 07:38:07'),(270,'Melbourne - Tullamarine','Chennai (Madras)','2025-02-21','2025-03-14','jacster58@gmail.com','Jacqui','Davey','0412320383','1','0','Economy','28-12-2024','2024-12-28 11:17:58'),(271,'Melbourne - Tullamarine','Hyderabad','2025-03-30','2025-04-20','creativeartistry2024@gmail.com','Sadia ','Sultana ','043 393 9306 ','1','0','Economy','30-12-2024','2024-12-30 16:11:56'),(272,'Melbourne - Tullamarine','Colombo','2025-06-27','2025-07-11','ddrg12@gmail.com','Don','Goonatillake','0401190251','1','0','Economy','30-12-2024','2024-12-30 21:36:44'),(273,'Hobart','Kathmandu - Tribhuvan','2025-01-22','2025-02-19','bhattachandinesh@gmail.com','Dinesh','Bhattachan','0435880206','2','0','Economy','31-12-2024','2024-12-31 01:47:15'),(274,'Canberra','Delhi, Indira Gandhi','2025-01-27','2025-02-13','bajwajazz@outlook.com','Jaswinder  Singh ','Bajwa','0425001183','1','0','Economy','31-12-2024','2024-12-31 15:04:24'),(275,'Perth Int&#039;l','Bangalore','2025-02-28','2025-03-29','mailme2023@yahoo.com','V','D','4123456789','2','0','Economy','31-12-2024','2024-12-31 15:10:34'),(276,'Sydney - Kingsford Smith','Ahmedabad','2025-04-30','2025-05-14','rajni3804@yahoo.co.in','RAJNIKANT','PARMAR','0401213086','4','0','Economy','01-01-2025','2025-01-01 10:30:31'),(277,'Melbourne - Tullamarine','Cochin','2025-06-27','2025-07-21','sangeetha_1777@yahoo.com','Manoj','Devasia','0434265828','5','0','Economy','01-01-2025','2025-01-01 14:56:51'),(278,'Melbourne - Tullamarine','Delhi, Indira Gandhi','2025-01-23','2025-02-10','Harry@hotmail.com','Harjinder ','Singh ','0405 235 014','1','0','Economy','02-01-2025','2025-01-02 10:29:54'),(279,'Sydney - Kingsford Smith','Kathmandu - Tribhuvan','2025-03-26','2025-04-25','tomnjerry123@hotmail.com','Rose','Tam','491751566','2','2','Economy','02-01-2025','2025-01-02 13:54:59'),(280,'Melbourne - Tullamarine','Colombo','2025-03-24','2025-04-07','placoaustralia@yahoo.com.au','Niroshan','Cr','0400000000','1','0','Economy','03-01-2025','2025-01-03 13:33:43'),(281,'Adelaide','Hyderabad','2025-01-08','2025-01-29','Karthik.reddy708@gmail.com','KARTHIK REDDY','Chiluka','0452181722','1','0','Economy','03-01-2025','2025-01-03 15:42:22'),(282,'Sydney - Kingsford Smith','Delhi, Indira Gandhi','2025-01-27','2025-02-17','amanbanga25@yahoo.com','Aman','Banga','0410721603','1','0','Economy','03-01-2025','2025-01-03 18:48:08'),(283,'Brisbane','Paro','2025-02-28','2025-03-08','tshewangrinzin800@gmail.com','Tshewang ','Rinzin','0431437717','1','0','Economy','05-01-2025','2025-01-05 17:53:43'),(284,'Melbourne - Tullamarine','Delhi, Indira Gandhi','2025-02-28','2025-03-17','munjal325@gmail.com','rituraj','chauham','0420405760','1','0','Economy','05-01-2025','2025-01-05 21:41:22'),(285,'Colombo','Alice Springs','2025-01-14','2025-04-29','cviskam@gmail.com','Chathura ','Lekamwasam ','450558507','1','0','Economy','06-01-2025','2025-01-06 03:44:50'),(286,'Melbourne - Tullamarine','Colombo','2025-02-28','2025-03-15','RubenMMcGraw@teleworm.us','Ruben','McGraw','89161336','4','0','Economy','06-01-2025','2025-01-06 21:07:43'),(287,'Melbourne - Tullamarine','Colombo','2025-12-19','2026-01-05','ashokal120@gmail.com','Ash','Li','0450687764','2','0','Economy','07-01-2025','2025-01-07 19:33:39'),(288,'Adelaide','Delhi, Indira Gandhi','2025-02-05','2025-02-25','sejky001@gmail.com','kash','kash','0421354488','1','0','Economy','10-01-2025','2025-01-10 18:13:08'),(289,'Brisbane','Launceston','2025-02-14','2025-02-17','mfreudigmann@gmail.com','Michael','Freudigmann','0423503197','2','0','Economy','10-01-2025','2025-01-10 23:37:00'),(290,'Sydney - Kingsford Smith','Amritsar','2025-01-13','','rohit9089@yahoo.com','Rohit','Sharma','0430419089','1','0','Economy','13-01-2025','2025-01-13 00:27:10'),(291,'Sydney - Kingsford Smith','Bombay','2025-01-19','2025-01-23','ABHAYVEKARIYA@YMAIL.COM','ABHAYKUMAR PARBATBHAI','VEKARIYA','0433057060','1','0','Economy','13-01-2025','2025-01-13 19:59:46'),(292,'Sydney - Kingsford Smith','Kathmandu - Tribhuvan','2025-03-12','2025-04-14','kc_baikuntha@yahoo.com','baikuntha','kc','0413475941','2','0','Economy','16-01-2025','2025-01-16 08:01:58'),(293,'Sydney - Kingsford Smith','Delhi, Indira Gandhi','2025-04-11','2025-04-30','balex63@hotmail.com','Brett','Alexander','0417281159','1','0','Economy','16-01-2025','2025-01-16 17:32:15'),(294,'Chennai (Madras)','Perth Int&#039;l','2025-01-28','','someshpavithran@gmail.com','Somesh Pavithran','Uma Shankar','0493941048','1','0','Economy','17-01-2025','2025-01-17 20:36:22'),(295,'Melbourne - Tullamarine','Amritsar','2025-02-15','2025-03-29','ranjitsursingh87@gmail.com','Ranjit','Singh','0475224011','2','0','Economy','17-01-2025','2025-01-17 21:07:54'),(296,'Sydney - Kingsford Smith','Amritsar','2025-02-26','2025-02-15','khjj@hjik.com','Ccc','Mmm','9876543210','1','0','Economy','19-01-2025','2025-01-19 13:20:48'),(297,'Brisbane','Colombo','2025-02-15','2025-02-27','thanapalfrancis@yahoo.co.uk','Thanapal Somasundram','Francis','0492421399','1','0','Economy','20-01-2025','2025-01-20 01:48:45'),(298,'Sydney - Kingsford Smith','Delhi, Indira Gandhi','2025-01-25','2025-02-07','suchitra.rana@sydney.edu.au','Suchitra','Rana','0403571350','1','0','Economy','20-01-2025','2025-01-20 13:51:47'),(299,'Sydney - Kingsford Smith','Ahmedabad','2025-01-31','2025-02-21','abc@yahoo.com','A','B','0123456789','1','0','Economy','21-01-2025','2025-01-21 08:37:24'),(300,'Melbourne - Tullamarine','Bangalore','2025-04-04','2025-04-30','naga_babu@yahoo.com','Babu','K','0402768043','2','0','Economy','21-01-2025','2025-01-21 12:18:40'),(301,'Brisbane','Amritsar','2025-02-13','2025-02-28','Dhaliwalch@gmail.com','Parmjit ','Dhaliwal ','0469 922 698 ','1','0','Economy','22-01-2025','2025-01-22 10:40:31'),(302,'Melbourne - Tullamarine','Colombo','2025-02-19','2025-03-07','nalin.ranatunga@binotrack.com.au','Nalin','Ranatunga','0430457057','1','0','Economy','22-01-2025','2025-01-22 12:53:00'),(303,'Melbourne, FL','Colombo','2025-04-12','2025-04-26','warunaks@yahoo.com','Waruna','Udahenkanda Lekamlage','0430214200','2','1','Economy','22-01-2025','2025-01-22 18:14:43'),(304,'Sydney - Kingsford Smith','Cochin','2025-12-20','2026-01-29','anoopabinish@gmail.com','Anoopa','Soman','0423 655 395 ','2','0','Economy','23-01-2025','2025-01-23 12:36:52'),(305,'Dallas/Ft. Worth, TX','Perth Int&#039;l','2025-05-08','','Cookgaynor@hotmail.com','Gaynor','Cook','0420975606','1','0','Economy','23-01-2025','2025-01-23 14:45:32'),(306,'Adelaide','Ahmedabad','2025-06-22','2025-07-19','grabsam@rediffmail.com','KEDAR','PANDYA','043','2','0','Economy','24-01-2025','2025-01-24 11:22:36'),(307,'Kathmandu - Tribhuvan','Melbourne - Tullamarine','2025-02-08','2025-05-08','tmngraz@gmail.com','Raj','Tamang','0451652504','2','0','Economy','24-01-2025','2025-01-24 14:23:47'),(308,'Melbourne - Tullamarine','Delhi, Indira Gandhi','2025-04-05','2025-04-15','kawal_singh@hotmail.com','Kawal ','Singh','0486009614','1','0','Economy','25-01-2025','2025-01-25 09:16:26'),(309,'Brisbane','Ahmedabad','2025-02-01','2025-03-08','chiragpatel8484@gmail.com','Chiragkumar ','Patel ','410848484','2','0','Economy','27-01-2025','2025-01-27 11:26:58'),(310,'Melbourne - Tullamarine','Delhi, Indira Gandhi','2025-08-13','2025-09-13','nycdonjatt@gmail.com','Tej','Sandhu','0423453794','2','0','Economy','28-01-2025','2025-01-28 00:12:12'),(311,'Abadan','Aarhus','2025-01-28','2025-01-28','ydeep9073@gmail.com','test','test','7895464123','1','0','Premium Economy','29-01-2025','2025-01-29 01:54:53'),(312,'Adelaide','Amritsar','2025-11-28','2026-01-17','shoky_75@yahoo.com','Ashok','Mahote ','0433191882','4','0','Economy','29-01-2025','2025-01-30 20:42:07'),(313,'Adelaide','Warsaw','2025-04-17','2025-04-26','platnews@yahoo.com','Maciej','Kowalski','0411021477','1','0','Economy','30-01-2025','2025-02-04 18:28:34'),(314,'Adelaide','Amritsar','2025-11-28','2026-01-17','shoky_75@yahoo.com','ashok','MAHOTE','0433191882','4','0','Economy','30-01-2025','2025-01-30 20:42:07'),(315,'Sydney - Kingsford Smith','Colombo','2025-03-15','2025-03-29','tharakama99@gmail.com','Maheshi','Arumahandi','0404510772','2','0','Economy','30-01-2025','2025-01-30 23:21:08'),(316,'Melbourne - Tullamarine','Colombo','2025-03-24','2025-04-17','etoindee@gmail.com','Ind','Gune','0450318498','2','2','Economy','31-01-2025','2025-01-31 13:36:11'),(317,'Brisbane','Amritsar','2025-02-14','2025-02-24','iqbalsingh8699@gmail.com','Surinder','Kaur','0431588749','1','0','Economy','02-02-2025','2025-02-02 15:04:15'),(318,'Sydney - Kingsford Smith','Hyderabad','2025-04-29','2025-05-29','vbajaj1975@yahoo.com','ritu','bajaj','0461327244','1','0','Economy','02-02-2025','2025-02-02 20:42:40'),(319,'Melbourne - Tullamarine','Ahmedabad','2025-03-19','2025-04-16','hetal1609@gmail.com','Hetal','PArekh','0469837414','1','0','Economy','03-02-2025','2025-02-03 13:49:52'),(320,'Brisbane','Kochi','2025-03-31','2025-03-30','moluvavababy@gmail.com','B a iju','Elanjikudiyil kunjuraman','0490360664','1','0','Economy','03-02-2025','2025-02-03 16:01:31'),(321,'Sydney - Kingsford Smith','Ahmedabad','2025-11-28','2025-12-20','Darshu288@yahoo.co.in','Darshita','Jani','0288470916','1','0','Economy','04-02-2025','2025-02-04 16:31:24'),(322,'Adelaide','Warsaw','2025-04-17','2025-04-26','platnews@yahoo.com','Maciej','Kowalski','0411021477','2','0','Economy','04-02-2025','2025-02-04 18:28:34'),(323,'Brisbane','Delhi, Indira Gandhi','2025-12-04','2026-01-12','kmukulphone@gmail.com','Mukul','Kumar','0469077911','3','0','Economy','05-02-2025','2025-02-05 11:57:08'),(324,'Melbourne - Tullamarine','Colombo','2025-04-06','2025-04-17','scott@phillipislandmarine.com.au','scott','huther','0427569267','6','0','Economy','07-02-2025','2025-02-07 17:27:47'),(325,'Melbourne - Tullamarine','Colombo','2025-04-12','2025-05-12','ishangaw@msn.com','Ish','Ish','0492835433','1','0','Economy','09-02-2025','2025-02-09 12:35:54'),(326,'Brisbane','Delhi, Indira Gandhi','2025-12-03','2026-01-12','kmukul@gmail.com','Mukul','Kumar','0469077911','1','0','Economy','09-02-2025','2025-02-09 16:37:26'),(327,'Melbourne - Tullamarine','Colombo','2025-04-02','2025-04-19','cdmfin@bigpond.com','Han','Peiris','0411658685','1','0','Economy','10-02-2025','2025-02-10 16:52:21'),(328,'Sydney - Kingsford Smith','Kathmandu - Tribhuvan','2025-03-03','2025-04-01','rupeshlal@hotmail.com','Rupesh ','Shrestha','0402170717','2','0','Economy','14-02-2025','2025-02-14 17:21:40'),(329,'Melbourne - Tullamarine','Colombo','2025-05-25','2025-07-28','mahimsydney11@gmail.com','mahima',' barwa','8839606603','2','0','Economy','14-02-2025','2025-02-14 22:54:36'),(330,'Melbourne - Tullamarine','Colombo','2025-05-25','2025-07-28','mahimajatwa@gmail.com','mahima','jatwa','8839606603','2','0','Economy','14-02-2025','2025-02-14 23:05:35'),(331,'Melbourne - Tullamarine','Colombo','2025-05-25','2025-07-28','mahimajatwa@gmail.com','Mahima ','Jatwa','8839606603','1','0','Economy','14-02-2025','2025-02-14 23:05:35'),(332,'Launceston','Delhi, Indira Gandhi','2026-01-01','2026-01-28','gurbakshbajwa@gmail.com','Gurbaksh','singh','0468306801','4','0','Economy','18-02-2025','2025-02-18 15:54:44'),(333,'Melbourne - Tullamarine','Tokyo - Haneda','2025-08-30','2025-09-04','mjdf0930@gmail.com','Mary Jane','Flores','0478784489','1','0','Economy','20-02-2025','2025-02-20 10:24:10'),(334,'Delhi, Indira Gandhi','Sydney - Kingsford Smith','2025-04-18','2025-04-18','carol.leuver@gmail.com','Carol','Leuver','0412398203','6','5','Economy','20-02-2025','2025-02-20 12:17:45'),(335,'Sydney - Kingsford Smith','Kathmandu - Tribhuvan','2025-03-24','2025-03-10','trishant.maharzn77@gmail.com','Trishant','Maharjan','0420711944','1','0','Economy','23-02-2025','2025-02-23 01:28:26'),(336,'Adelaide','Cochin','2025-07-03','2025-07-18','saki@thetotal.com.au','Saki','Jameson','0435944052','2','1','Economy','25-02-2025','2025-02-25 18:08:03'),(337,'Melbourne - Tullamarine','Cochin','2025-03-26','2025-04-16','nithucherian25@gmail.com','Nithu','Kattampallyil Cherian','0497097372','2','1','Economy','25-02-2025','2025-02-25 20:45:47'),(338,'Melbourne, FL','Colombo','2025-12-20','2026-01-15','kanchana.lfn.wyb@gmail.com','Kanchana','De silva','0456674977','2','0','Economy','26-02-2025','2025-02-26 16:50:36'),(339,'Adelaide','Delhi, Indira Gandhi','2025-11-19','2026-01-17','vinitdevganvini@gmail.com','Vaneet','Devgan','0412787084','2','1','Economy','01-03-2025','2025-03-01 11:18:33'),(340,'Melbourne - Tullamarine','Delhi, Indira Gandhi','2025-03-07','2025-03-13','hsbhullar80@yahoo.co.in','Hardeep','Bhullar','0433336662','1','0','Economy','03-03-2025','2025-03-03 06:50:36'),(341,'Melbourne, FL','Cochin','2025-04-14','2025-04-30','arjun.pavithran9966@gmail.com','Arjun','Pavithran','0421350787','2','0','Economy','03-03-2025','2025-03-03 11:29:48'),(342,'Sydney - Kingsford Smith','Delhi, Indira Gandhi','2026-01-06','2026-02-03','saurabh7garg@gmail.com','Saurabh','Kumar','0405977202','1','0','Economy','04-03-2025','2025-03-04 17:43:58'),(343,'Sydney - Kingsford Smith','Ahmedabad','2025-12-09','2026-01-15','bhavin_6333@yahoo.com','patel','bhavin','0430543628','2','0','Economy','04-03-2025','2025-03-04 23:31:04'),(344,'Sydney - Kingsford Smith','Delhi, Indira Gandhi','2025-06-05','2025-06-20','harmindermokha@hotmail.com','Harminder ','Singh','0412380432','1','0','Economy','05-03-2025','2025-03-05 12:25:11'),(345,'Melbourne - Tullamarine','Cochin','2025-06-18','2025-07-03','puthusee@hotmail.com','ADAM','MATHEW','0466631899','1','0','Economy','07-03-2025','2025-03-07 00:23:02'),(346,'Melbourne - Tullamarine','Colombo','2025-04-18','2025-04-26','serenadanvers@gmail.com','Serena ','Fonseka ','0468886884','2','0','Economy','10-03-2025','2025-03-10 03:17:18'),(347,'Melbourne - Tullamarine','Cochin','2025-06-28','2025-07-26','manojmathew71@gmail.com','Manoj ','Mathew','0449825295','3','0','Economy','10-03-2025','2025-03-10 18:13:17'),(348,'Melbourne, FL','Colombo','2025-04-17','2025-04-25','niranjala.hettiarachchi@toyota.com.au','Niranjala','Hettiarachchi','0414504310','4','0','Economy','11-03-2025','2025-03-11 11:09:07'),(349,'Sydney - Kingsford Smith','Ahmedabad','2025-12-16','2026-01-17','akansudiya@gmail.com','Arvindkumar','Kansudiya','0421381538','2','0','Economy','12-03-2025','2025-03-12 21:48:57'),(350,'Brisbane','Port Vila','2025-04-17','2025-03-28','chrisvurovile@gmail.com','Chris ','Vuro ','0402000517','0','0','Economy','13-03-2025','2025-03-13 15:21:04'),(351,'Brisbane','Colombo','2025-03-28','2025-04-04','kchinthaka740@gmail.com','Kasun','Chinthaka','0430031516','1','0','Economy','17-03-2025','2025-03-17 14:13:06'),(352,'Melbourne - Tullamarine','Ahmedabad','2025-12-26','2025-12-30','patel39929@gmail.com','Nishit','Patel','0433919318','1','0','Economy','17-03-2025','2025-03-23 10:52:40'),(353,'Sydney - Kingsford Smith','Hyderabad - Begumpet','2025-04-11','2025-04-20','ssingh210988@gmail.com','Shreshtha','singh','0420651725','1','0','Economy','18-03-2025','2025-03-18 03:44:01'),(354,'Melbourne, FL','Colombo','2025-04-17','2025-04-26','ganga23@hotmail.com','Gangatharan','Yogalingam','0452668703','1','0','Economy','18-03-2025','2025-03-18 23:23:36'),(355,'Sydney - Kingsford Smith','Delhi, Indira Gandhi','2025-04-07','2025-04-30','parmodmadan97@gmail.com','Parmod','Madan','0434139801','1','0','Economy','19-03-2025','2025-03-19 13:19:50'),(356,'Bangalore','Amritsar','2025-04-25','2025-05-02','xyz@gmail.com','hfghfg','hfghfg','9891496312','1','0','Economy','19-03-2025','2025-03-19 20:19:29'),(357,'Delhi, Indira Gandhi','Cochin','2025-05-10','2025-05-15','wiriy14795@erapk.com','aniketh','chauhan','9891496318','2','0','Economy','19-03-2025','2025-03-19 21:26:37'),(358,'Melbourne, FL','Hyderabad - Begumpet','2025-04-17','2025-04-26','kiran.babu12@gmail.com','VENKAT','KOT','0469838278','1','0','Economy','21-03-2025','2025-03-21 13:19:29'),(359,'Sydney - Kingsford Smith','Colombo','2025-12-25','2026-01-15','nimalw7@googlemail.com','Nimal','Weerasinghe','0450101319','1','0','Economy','22-03-2025','2025-03-22 16:32:15'),(360,'Melbourne - Tullamarine','Ahmedabad','2025-12-30','2026-01-30','patel39929@gmail.com','Nishit','Patel','0433919318','1','0','Economy','23-03-2025','2025-03-23 10:52:40'),(361,'Melbourne - Tullamarine','Delhi, Indira Gandhi','2025-04-25','2025-05-23','brarharchet752@gmail.com','Harchet ','Brar','0423615971','2','0','Economy','23-03-2025','2025-03-23 13:08:44'),(362,'Delhi, Indira Gandhi','Melbourne - Tullamarine','2025-04-20','2025-09-06','vinaygoyal79@yahoo.com','Vinay','Goyal','0452636709','1','0','Economy','24-03-2025','2025-03-24 16:55:10'),(363,'Brisbane','Delhi, Indira Gandhi','2025-12-01','2026-01-05','parmjeet61@yahoo.com','Parmjeet','Parmjeet','0433083535','2','0','Economy','25-03-2025','2025-03-25 23:07:45'),(364,'Melbourne - Tullamarine','Colombo','2025-04-21','2025-04-28','cedon1962@gmail.com','Chandrasoma ','Elvitigalage Don ','0409387036','1','0','Economy','26-03-2025','2025-03-26 12:57:10'),(365,'Brisbane','Ahmedabad','2025-04-15','2025-04-29','kaminipatel2882@gmail.com','Kaminiben','Patel','0414278260','1','0','Economy','28-03-2025','2025-03-28 13:26:36'),(366,'Sydney - Kingsford Smith','Cochin','2025-11-10','2025-12-10','rt@test.com','Ro','T','0422675933','1','0','Economy','29-03-2025','2025-03-29 12:47:32'),(367,'Melbourne, FL','Chandigarh','2025-03-31','2025-04-15','afhf@gmail.com','Jhfdr','Fftgg','0424458870','1','1','Economy','31-03-2025','2025-03-31 07:54:57'),(368,'Delhi, Indira Gandhi','Melbourne - Tullamarine','2025-06-19','2025-09-16','singhgurjas2904@gmail.com','Gurjas','Singh','0416682904','2','0','Economy','01-04-2025','2025-04-01 18:25:05'),(369,'Colombo','Melbourne, FL','2025-04-14','2025-07-10','amarasi79@gmail.com','Anusha','Amarasinghe','0423097805','1','0','Economy','02-04-2025','2025-04-02 22:43:19'),(370,'Adelaide','Colombo','2025-05-01','2025-06-05','upalisilva@hotmail.com','UPALI','WEERASINGGHE','0422598328','1','0','Economy','03-04-2025','2025-04-03 02:01:09'),(371,'Adelaide','Cochin','2025-04-07','2025-04-10','jilljoypakkattil@yahoo.co.in','JILL','JOY','0422525127','1','0','Economy','06-04-2025','2025-04-06 12:07:27'),(372,'Adelaide','Colombo','2025-06-01','2025-06-21','kasun.uda1985@gmail.com','Kasun ','Gode Kankanamge ','0477518266','1','0','Economy','10-04-2025','2025-04-10 23:12:06'),(373,'Melbourne, FL','Delhi, Indira Gandhi','2025-04-17','2025-05-09','asha_goyal@yahoo.com.au','Asha','Goyal','0408232333','1','0','Economy','12-04-2025','2025-04-12 02:37:47'),(374,'Melbourne - Tullamarine','Ahmedabad','2025-12-15','2026-01-23','utsaveeshah@gmail.com','Utsavee ','Shah','0450275257','2','0','Economy','12-04-2025','2025-04-12 17:23:27'),(375,'Melbourne - Tullamarine','Thiruvananthapuram','2025-12-02','2026-02-02','ansu4jesus@yahoo.com','ANSU ANNIE','GEORGE','0492331560','2','0','Economy','12-04-2025','2025-04-12 23:22:24'),(376,'Sydney - Kingsford Smith','Ahmedabad','2025-06-28','2025-07-23','skumar2513@gmail.com','sohilkumar','patel','0425541014','2','0','Economy','14-04-2025','2025-04-14 15:48:51'),(377,'Sydney - Kingsford Smith','Colombo','2025-11-24','2026-02-03','anwar19sadath@gmail.com','Anwar Sadath','Yaseen Bawa','0426396665','3','0','Economy','20-04-2025','2025-04-20 14:04:26'),(378,'Melbourne - Tullamarine','Colombo','2025-07-01','2025-07-15','kumari77777@yahoo.com','Kumari','Herath','0435957181','5','0','Economy','21-04-2025','2025-04-21 15:52:48'),(379,'Melbourne - Tullamarine','Ahmedabad','2025-12-09','2026-01-28','hiren_4899@yahoo.co.in','Hiren','Prajapati ','0434855771','2','0','Economy','21-04-2025','2025-04-21 23:34:50'),(380,'Adelaide','Amritsar','2025-12-29','2026-01-31','manpisohi85@ymail.com','MANPREET','SIDHU','0425354637','2','0','Economy','23-04-2025','2025-04-23 04:45:52'),(381,'Melbourne - Tullamarine','Cochin','2025-12-19','2026-01-24','nijithmohan@yahoo.com','Nijith','Erakkathil','0450853206','3','0','Economy','24-04-2025','2025-04-24 13:53:32'),(382,'Brisbane','Bombay','2025-12-13','2025-12-26','kaynamjoshi@gmail.com','Kaustubh','Namjoshi','0425490907','2','0','Economy','24-04-2025','2025-04-24 14:26:30'),(383,'Melbourne - Tullamarine','Delhi, Indira Gandhi','2025-07-02','2025-08-13','poonampoorvansh@gmail.com','Poonam','Shukla','0451851499','1','0','Economy','24-04-2025','2025-04-24 18:58:30'),(384,'Adelaide','Ahmedabad','2025-06-20','2025-08-20','ketand2805@gmail.com','KP ','KP ','0475782368','1','0','Business','25-04-2025','2025-04-25 19:31:28'),(385,'Delhi, Indira Gandhi','Melbourne - Tullamarine','2025-05-02','2025-05-03','sheerapurewalno2@yahoo.com','Jasvir','Singh','0468855617','1','0','Economy','27-04-2025','2025-04-27 19:19:12'),(386,'Brisbane','Ahmedabad','2025-11-25','2026-01-27','truptikachhadiya@yahoo.com.au','Trupti ','Kachhadiya ','0402939849','1','0','Economy','29-04-2025','2025-04-29 18:02:31'),(387,'Sydney - Kingsford Smith','Delhi, Indira Gandhi','2025-11-22','2026-01-05','kuunvar.yadav@gmail.com','Kunvar','yadav','0425238401','3','1','Economy','01-05-2025','2025-05-01 12:35:00'),(388,'Adelaide','Colombo','2025-07-27','2025-08-24','dilushifonseka@hotmail.com','Dilushi','Fonseka','0401394494','4','0','Economy','02-05-2025','2025-05-02 13:52:44'),(389,'Sydney - Kingsford Smith','Amritsar','2025-05-20','2025-06-08','parmar.sa@yahoo.com','sara','kaur','0401193944','1','0','Economy','03-05-2025','2025-05-03 11:22:15'),(390,'Adelaide','Ahmedabad','2025-11-06','2026-01-09','ruchibhatt5496@gmail.com','Ruchi','Bhatt','0435407641','2','0','Economy','03-05-2025','2025-05-03 22:10:45'),(391,'Melbourne - Tullamarine','Delhi, Indira Gandhi','2025-12-15','2026-01-27','gillkuldeep@y7mail.com','sunny','gill','0415388986','2','2','Economy','04-05-2025','2025-05-04 17:54:19'),(392,'Melbourne - Tullamarine','Kathmandu - Tribhuvan','2025-09-16','2025-10-01','ajfood@yahoo.com.au','PP','SS','4401560048','1','0','Business','05-05-2025','2025-05-05 21:42:37'),(393,'Sydney - Kingsford Smith','Bombay','2025-12-24','2026-01-31','siraj_29@yahoo.com','Jumana','Ansari','0452530464','1','0','Economy','08-05-2025','2025-05-08 12:22:32'),(394,'Hervey Bay','Cairns','2025-06-12','2025-06-15','kltingle15@gmail.com','Karen ','Douma','0402280977','1','0','Premium Economy','12-05-2025','2025-05-12 11:38:43'),(395,'Adelaide','Delhi, Indira Gandhi','2025-11-22','2026-01-25','prabhjots627@gmail.com','Prabhjot','Singh','0424855556','1','0','Economy','12-05-2025','2025-05-12 16:06:49'),(396,'Melbourne - Tullamarine','Colombo','2025-12-23','2026-02-06','shanika_02@yahoo.com.au','Shanika','Thenahandi','0433266044','2','2','Economy','20-05-2025','2025-05-20 13:43:23'),(397,'Cairns','Kochi','2025-12-21','2026-01-13','manojabraham1234@gmail.com','Manoj','Abraham','0493715983','4','1','Economy','20-05-2025','2025-05-20 15:24:11'),(398,'Melbourne - Tullamarine','Ahmedabad','2026-01-03','2026-01-23','aapatel5896@gmail.com','Adarsh','Patel','0481817410','1','0','Economy','22-05-2025','2025-05-22 08:59:13'),(399,'Brisbane','Melbourne - Tullamarine','2025-05-22','2025-05-31','tassieseabreeze@gmail.com','Tom','Harvey','0478721523','1','0','Economy','22-05-2025','2025-05-22 12:44:28'),(400,'Longreach','Brisbane','2025-05-31','2025-05-31','weazy@live.com.au','Alicia','Madsen','0487643549','1','0','Economy','22-05-2025','2025-05-22 15:26:53'),(401,'Melbourne - Tullamarine','Kathmandu - Tribhuvan','2025-11-02','2025-11-20','edfvdsgvfdg@email.com','sadsdsd','sdsdsdsd','0480433333','1','0','Economy','24-05-2025','2025-05-24 17:47:56'),(402,'Melbourne - Tullamarine','Dhaka','2025-06-24','2025-07-21','eeerafiqul@gmail.com','Muhammad Rafiqul','Islam','0458944497','2','0','Economy','26-05-2025','2025-05-26 17:07:38'),(403,'Melbourne - Tullamarine','Thiruvananthapuram','2026-01-02','2026-01-24','achristopher@bendigohealth.org.au','annie','christopher','0421599741','2','0','Economy','28-05-2025','2025-05-28 17:38:17'),(404,'Melbourne - Tullamarine','Thiruvananthapuram','2026-01-02','2026-01-25','achristopher@bendigohealth.org.au','Annie','christopher','0421599741','1','0','Economy','28-05-2025','2025-05-28 17:38:17'),(405,'Sydney - Kingsford Smith','Delhi, Indira Gandhi','2025-12-18','2026-02-06','marlarwin0950@gmail.com','Mar','lar','0404999522','1','0','Economy','29-05-2025','2025-05-29 15:26:14'),(406,'Melbourne - Tullamarine','Colombo','2025-07-10','2025-07-20','nirasha@hotmail.com.au','Nirasha','Silva','0431434773','1','1','Economy','30-05-2025','2025-05-30 13:02:36'),(407,'Melbourne, FL','Delhi, Indira Gandhi','2025-12-25','2026-02-08','gurpreetkr99@gmail.com','gurpreet','kaur','0490949796','2','0','Economy','30-05-2025','2025-05-30 15:48:38'),(408,'Darwin','Sydney - Kingsford Smith','2025-05-31','2025-06-03','chrisr45101@gmail.com','Cate','Steven','0488291389','1','0','Economy','30-05-2025','2025-05-30 18:19:33'),(409,'Abadan','Aarhus','2025-05-30','2025-05-30','yashdeep@vibrantick.in','test','test','7412589630','2','0','Economy','30-05-2025','2025-05-30 20:45:25'),(410,'Adelaide','Bombay','2025-06-07','2025-06-07','jigneshjjjj@gmail.com','Jignesh','Gajera','0473124165','1','0','Economy','30-05-2025','2025-05-30 20:55:51'),(411,'Brisbane','Melbourne - Tullamarine','2025-06-04','2025-06-06','charlieboyeggers@gmail.com','Charlie','Eggers','0474807383','1','0','Business','03-06-2025','2025-07-03 19:19:32'),(412,'Sydney - Kingsford Smith','London - Heathrow','2025-09-22','2025-10-15','bw3098@telus.net','Beverley','Wardstrom','2503743098','2','0','Economy','05-06-2025','2025-06-05 03:09:53'),(413,'Emerald','Sydney - Kingsford Smith','2025-06-07','2025-06-07','tuipulotumatafonua@gmail.com','Matafonua','Tuipulotu','0476686180','1','0','Economy','05-06-2025','2025-06-05 21:14:01'),(414,'Brisbane','Las Vegas, NV','2026-02-26','2026-03-15','angepratt73@hotmail.com','Angela','Pratt','0481707588','1','0','Economy','07-06-2025','2025-06-07 09:32:30'),(415,'Melbourne - Tullamarine','Ahmedabad','2026-02-25','2026-04-03','banti4144@yahoo.com','Bunty','Bhatt','0416894011','2','0','Economy','07-06-2025','2025-06-07 10:46:52'),(416,'Ahmedabad','Brisbane','2025-11-18','2026-02-14','ghhj@gmail.com','Gghh','Gghj','09987776666','2','0','Economy','07-06-2025','2025-06-07 17:28:43'),(417,'Melbourne - Tullamarine','Canberra','2025-06-07','2025-06-09','sujan.sitaula1994@gmail.com','Sujan','Sitaula','0416840208','1','0','Economy','07-06-2025','2025-06-07 19:10:29'),(418,'Sydney - Kingsford Smith','Kathmandu - Tribhuvan','2025-09-26','2025-10-16','abisekbisural10@gmail.com','Bisural','Abisek','0450510119','1','0','Economy','08-06-2025','2025-06-08 16:58:01'),(419,'Melbourne - Tullamarine','Delhi, Indira Gandhi','2025-07-04','2025-07-15','ssbnirma@gmail.com','Shitanshoo','Bhardwaj','0416048832','1','0','Economy','08-06-2025','2025-06-08 17:13:52'),(420,'Melbourne - Tullamarine','Sunshine Coast','2025-07-11','2025-07-13','melaniealderton1980@outlook.com','Melanie','Alderton','0461525030','1','0','Economy','09-06-2025','2025-06-09 01:00:50'),(421,'Melbourne, FL','Colombo','2025-09-01','2025-10-05','harsha3122@gmail.com','Harsha','Amaratunga','0422265510','1','0','Economy','10-06-2025','2025-06-10 00:19:19'),(422,'Adelaide','Brisbane','2025-06-12','2025-06-12','juliacs1992@gmail.com','Julia','Sherwood','0432048269','1','0','Economy','12-06-2025','2025-06-12 17:03:01'),(423,'Brisbane','Delhi, Indira Gandhi','2025-06-13','2025-06-30','dakshjain2607@gmail.com','Daksh','Jain','0402549951','1','0','Economy','12-06-2025','2025-06-12 19:05:03'),(424,'Melbourne - Tullamarine','Thiruvananthapuram','2025-12-04','2026-02-02','manoj.thomas.au@gmail.com','MANOJ','THOMAS','061424743818','2','0','Economy','13-06-2025','2025-06-13 16:25:04'),(425,'Melbourne - Tullamarine','Dhaka','2025-12-20','2026-01-15','nadirasultanakakoly@gmail.com','Nadira Sultana','Kakoly','0426945113','3','0','Economy','15-06-2025','2025-06-15 20:47:18'),(426,'Melbourne - Tullamarine','Dhaka','2025-12-31','2026-01-31','rimu143@yahoo.com','Rimon','Hasan','0448056890','2','1','Economy','17-06-2025','2025-06-17 00:49:58'),(427,'Launceston','Colombo','2025-08-22','2025-09-07','chamod.rajaguru@gmail.com','Rajaguru','Chamod','0429609533','2','0','Economy','17-06-2025','2025-06-17 14:36:36'),(428,'Melbourne - Tullamarine','Delhi, Indira Gandhi','2025-07-23','2025-08-12','sindhikamal@ymail.com','Kamal','Sindhi','0430678900','1','0','Economy','17-06-2025','2025-06-17 23:33:30'),(429,'Adelaide','Colombo','2025-07-03','2025-07-12','ishan.amarasingha@gmail.com','Ishan Thilina','Amarasinghe Arachchilage','0430233231','1','0','Economy','18-06-2025','2025-06-18 11:38:40'),(430,'Melbourne - Tullamarine','Dhaka','2025-12-13','2026-01-03','sazid.zaman@gmail.com','sazid','Zaman','0469609093','2','0','Economy','20-06-2025','2025-06-20 18:33:31'),(431,'Brisbane','Colombo','2025-09-02','2025-10-09','hema.wije@gmail.com','Hemantha','Wijesundara','0433657243','2','0','Economy','20-06-2025','2025-06-20 21:12:17'),(432,'Melbourne - Tullamarine','Kathmandu - Tribhuvan','2025-12-01','2026-01-24','ruk_yesh@hotmail.com','Rukesh','Shahi Khadgi','0415286983','2','0','Economy','23-06-2025','2025-06-23 11:31:07'),(433,'Melbourne, FL','Colombo','2025-12-17','2026-01-17','frankd148@gmail.com','KODIKARA','DIAS','0451070860','4','0','Economy','23-06-2025','2025-06-23 14:11:29'),(434,'Melbourne - Tullamarine','Colombo','2025-12-30','2026-02-01','besolv@gmail.com','bell','solv','0412333444','3','0','Economy','24-06-2025','2025-06-24 12:54:38'),(435,'Melbourne - Tullamarine','Bangkok','2025-09-22','2025-09-28','kandelmanoj15@gmail.com','Manoj','Kandel','0420394794','3','0','Economy','25-06-2025','2025-06-25 13:45:19'),(436,'Kathmandu - Tribhuvan','Devonport','2025-08-09','2025-10-20','bikashjenny95@gmail.com','Sushma','Gyawali','0450903470','1','0','Economy','26-06-2025','2025-06-26 19:05:56'),(437,'Melbourne - Tullamarine','Sydney - Kingsford Smith','2025-06-27','2025-06-27','jdevi0360@gmail.com','Jyoti','Devi','0416282571','1','0','Economy','27-06-2025','2025-06-27 12:14:47'),(438,'Adelaide','Colombo','2025-09-16','2025-10-07','rlobendhanm@murraystreetmedical.com.au','ROSHAN','LOBENDHAN','0451060682','1','0','Economy','27-06-2025','2025-06-27 17:40:59'),(439,'Brisbane','Hyderabad','2025-12-25','2026-02-26','gksrsk@gmail.com','Karthik ','Gorugantu ','0455366863','2','0','Economy','27-06-2025','2025-06-27 19:03:59'),(440,'Sydney - Kingsford Smith','Dhaka','2025-07-31','2025-07-12','hseraji@gmail.com','MD HABIBUR','SERAJI','0423306317','2','0','Economy','29-06-2025','2025-07-12 00:30:30'),(441,'Adelaide','Delhi, Indira Gandhi','2025-09-14','2025-10-23','sony@gmail.com','Sony','Kaur','0431433365','2','0','Economy','30-06-2025','2025-07-19 00:47:12'),(442,'Sydney - Kingsford Smith','Santiago de Chile - Arturo Merino Benitez','2025-10-06','2025-11-03','cjdulcey12@gmail.com','Claudia ','Dulcry','0426945610','1','0','Economy','02-07-2025','2025-07-02 15:14:41'),(443,'Sydney - Kingsford Smith','Delhi, Indira Gandhi','2025-07-08','2025-07-15','MONALAMANU@YAHOO.IN','monu ','monala ','0433161200','2','0','Economy','03-07-2025','2025-07-03 13:45:56'),(444,'Brisbane','Singapore - Changi','2025-07-07','2025-07-10','charlieboyeggers@gmail.com','Charlie','Eggers','0474807383','1','0','First','03-07-2025','2025-07-03 19:19:32'),(445,'Rockhampton','Brisbane','2025-07-04','2025-07-09','jenhart6984@gmail.com','Jennifer','Hart','0413859940','1','0','Economy','04-07-2025','2025-07-04 07:05:36'),(446,'Delhi, Indira Gandhi','Melbourne - Tullamarine','2025-10-18','2025-11-23','isha0001@gmail.com','test','test','0411854226','2','0','Economy','05-07-2025','2025-07-05 16:45:40'),(447,'Melbourne - Tullamarine','Colombo','2026-01-13','2026-01-30','sujeekari@gmail.com','Sujee','KARIYAWASAM','0410361499','4','0','Economy','08-07-2025','2025-07-08 15:43:01'),(448,'Sydney - Kingsford Smith','Cochin','2026-01-07','2025-07-27','majofranco1@gmail.com','MAJO','FRANCO','0470363701','2','0','Economy','11-07-2025','2025-07-11 12:13:49'),(449,'Sydney - Kingsford Smith','Dhaka','2025-07-27','2025-08-15','hseraji@gmail.com','MD HABIBUR','SERAJI','0423306317','2','0','Economy','12-07-2025','2025-07-12 00:30:30'),(450,'Sydney - Kingsford Smith','Tokyo','2025-07-13','2025-07-21','maria.finau@hotmail.com','Maria','Finau','0426226193','2','0','Economy','12-07-2025','2025-07-12 15:31:38'),(451,'Brisbane','Adelaide','2025-07-20','2025-07-20','akimanyim@gmail.com','Alex','Kimanyim','0416817132','1','0','Economy','12-07-2025','2025-07-12 18:26:16'),(452,'Adelaide','Cochin','2025-07-14','2025-07-25','jpj1912@hotmail.com','John','Jacob','0413491113','1','0','Economy','13-07-2025','2025-07-13 19:44:11'),(453,'Melbourne - Tullamarine','Kathmandu - Tribhuvan','2025-09-20','2025-10-30','rejinapanday07@gmail.com','Rejina','Pandey','0410581101','1','0','Economy','14-07-2025','2025-07-14 11:33:47'),(454,'Adelaide','Bombay','2025-12-16','2026-01-09','fbmtpavmsnnzipmsnq@nesopf.com','fbmt','msnq','0451000000','1','0','Economy','15-07-2025','2025-07-15 01:47:41'),(455,'Groote Eyeland','Katherine','2025-07-22','2025-07-22','jeannalalara4@gmail.com','Selwyn ','Bara','0467818203','1','0','Economy','15-07-2025','2025-07-15 17:22:45'),(456,'Melbourne - Tullamarine','Colombo','2025-11-28','2025-12-30','susipsara@gmail.com','Susipsara ','Dehigaspitiya ','0421528015','2','0','Economy','15-07-2025','2025-07-15 19:58:13'),(457,'Sydney - Kingsford Smith','Amritsar','2025-11-20','2025-12-31','gurinders77@hotmail.com','Gurinder','Singh','0402848286','3','0','Economy','15-07-2025','2025-07-15 23:39:40'),(458,'Brisbane','Delhi, Indira Gandhi','2026-01-06','2026-02-23','gurpreet22smart@yahoo.com','Gurpreet','Singh','0470405729','2','0','Economy','16-07-2025','2025-07-16 19:51:36'),(459,'Sydney - Kingsford Smith','Amritsar','2025-11-26','2026-01-16','vikesh251@gmail.com','Shallu','budhiraja','0424937676','1','0','Economy','17-07-2025','2025-07-17 15:51:51'),(460,'Devonport','Melbourne - Tullamarine','2025-07-18','2025-07-22','kaishiaainslie@gmail.com','Kaishia','Ainslie ','0480624083','1','0','Economy','17-07-2025','2025-07-17 19:49:55'),(461,'Adelaide','Hyderabad','2025-12-12','2026-01-04','ashishnarke@yahoo.com','Ashish','Narke','0452628620','1','0','Economy','18-07-2025','2025-07-18 22:04:20'),(462,'Adelaide','Delhi, Indira Gandhi','2025-09-26','2025-07-31','Sony@gmail.com','Sony','Kaur','0431431019','2','2','Economy','19-07-2025','2025-07-19 00:47:12'),(463,'Melbourne - Tullamarine','Bangalore','2025-12-20','2026-01-20','heyehhe@gmail.com','Hshhshhs','Hhsbh','04563837388','1','0','Economy','21-07-2025','2025-07-21 15:15:21'),(464,'Melbourne - Tullamarine','Bombay','2025-12-16','2026-01-23','tkcsr22@gmail.com','Tapan','Kadakia','0403775462','2','0','Economy','21-07-2025','2025-07-21 15:24:21'),(465,'Melbourne - Tullamarine','Cairns','2025-10-17','2025-10-20','mchambo199q@gmail.com','Matt','Chamberlain','0418602605','21','0','Economy','22-07-2025','2025-07-22 16:47:09'),(466,'Sydney - Kingsford Smith','Bombay','2026-01-01','2026-01-25','alif1racer@gmail.com','Aliasger','Hasam','0459364876','1','0','Economy','28-07-2025','2025-07-28 14:51:23'),(467,'Sydney - Kingsford Smith','Miami, FL','2025-08-13','2025-08-30','ferti@yopmail.com','ferti','gomez','2124547878','1','0','Economy','30-07-2025','2025-07-30 09:38:37'),(468,'Melbourne - Tullamarine','Bombay','2025-12-23','2026-01-19','justemmmm@gmail.com','Em','Mma','0417047198','2','0','Economy','30-07-2025','2025-07-30 18:05:51'),(469,'Sydney - Kingsford Smith','Colombo','2025-10-03','2025-10-08','hashiniom@gmail.com','Ojitha ','Manthrivithana Swampille ','0475048346','1','0','Economy','02-08-2025','2025-08-02 20:41:40'),(470,'Melbourne - Tullamarine','Lahore','2025-09-01','2025-08-31','isitlove4858@gmail.com','Ammar','Hassan','3004858681','1','0','Economy','03-08-2025','2025-08-03 01:57:43'),(471,'Melbourne - Tullamarine','Ahmedabad','2025-08-25','2025-10-25','rkoza3070@gmail.com','Ruchit','Prajapati','0435263929','1','0','Economy','03-08-2025','2025-08-03 15:10:12'),(472,'Tamworth','Brisbane','2025-08-04','2025-08-04','etyagrace04@gmail.com','Grace','Etyang','0406297664','1','0','Economy','04-08-2025','2025-08-04 08:09:58'),(473,'Melbourne - Tullamarine','Bombay','2025-10-03','2025-10-18','rkhwaja@outlook.com','Rahmatullah ','Khwaja','0411280877','1','0','Economy','04-08-2025','2025-08-04 13:10:15'),(474,'Sydney - Kingsford Smith','Bangkok','2025-08-22','2025-09-02','bavani.santhira12@gmail.com','Sanjay','Chandrasekara','0401346599','1','0','Economy','06-08-2025','2025-08-06 16:53:40'),(475,'Sydney - Kingsford Smith','Hyderabad - Begumpet','2025-09-23','2025-09-27','thakurvinodsingh8766@gmail.com','vinod','singh','0470532912','1','0','Economy','06-08-2025','2025-08-06 22:28:45'),(476,'Sydney - Kingsford Smith','Beirut','2026-06-22','2025-08-27','f.aoun0@icloud.com','Fadi ','Aoun ','0418555200','2','0','Economy','10-08-2025','2025-08-10 12:50:45'),(477,'Gladstone','Colombo','2025-12-20','2026-01-18','jnksam@gmail.com','Janaki','Samarakoon ','0493267540','2','0','Economy','10-08-2025','2025-08-10 13:57:56'),(478,'Melbourne - Tullamarine','Colombo','2025-09-18','2025-10-03','ynalaka@gmail.com','Nalaka','Thilaka','0430070681','2','2','Economy','11-08-2025','2025-08-11 03:06:20');
/*!40000 ALTER TABLE `air_ticket` ENABLE KEYS */;
UNLOCK TABLES;

--
-- Table structure for table `airport`
--

DROP TABLE IF EXISTS `airport`;
/*!40101 SET @saved_cs_client     = @@character_set_client */;
/*!50503 SET character_set_client = utf8mb4 */;
CREATE TABLE `airport` (
  `airport_id` int NOT NULL AUTO_INCREMENT,
  `airport` varchar(255) COLLATE utf8mb4_general_ci NOT NULL,
  `airport_code` varchar(255) COLLATE utf8mb4_general_ci NOT NULL,
  `status` varchar(255) COLLATE utf8mb4_general_ci NOT NULL,
  PRIMARY KEY (`airport_id`)
) ENGINE=InnoDB AUTO_INCREMENT=1812 DEFAULT CHARSET=utf8mb4 COLLATE=utf8mb4_general_ci;
/*!40101 SET character_set_client = @saved_cs_client */;

--
-- Dumping data for table `airport`
--

LOCK TABLES `airport` WRITE;
/*!40000 ALTER TABLE `airport` DISABLE KEYS */;
INSERT INTO `airport` VALUES (5,'Algiers','ALG','1'),(6,'Annaba','AAE','1'),(7,'Constantine','CZL','1'),(8,'Oran (Ouahran)-ORN','ORN','1'),(9,'Bengueka','BUG','1'),(10,'Cabinda','CAB','1'),(11,'Luanda ','LAD','1'),(12,'Cotonou','COO','1'),(13,'Francistown','FRW','1'),(14,'Gaborone','GBE','1'),(15,'Maun','MUB','1'),(16,'Selibi Phikwe','PKW','1'),(17,'Bobo/Dioulasso','BOY','1'),(18,'Ouagadougou','OUA','1'),(19,'Sal','SID','1'),(20,'Bambari','BBY','1'),(21,'Bangassou','BGU','1'),(22,'Bangui','BGF','1'),(23,'Berberati','BBT','1'),(24,'Biraro','IRO','1'),(25,'Bria','BIV','1'),(26,'Carnot','CRF','1'),(27,'Ouadda','ODA','1'),(28,'Abeche','AEH','1'),(29,'Moundou','MQQ','1'),(30,'N\'Djamena','NDJ','1'),(31,'Anjouan','AJN','1'),(32,'Moroni - Prince Said Ibrahim','HAH','1'),(33,'Moroni - Iconi','YVA','1'),(34,'Brazzaville','BZV','1'),(35,'Pointe Noire','PNR','1'),(36,'Kinshasa - N\'Djili','FIH','1'),(37,'Lisala','LIQ','1'),(38,'Yamoussoukro','ASK','1'),(39,'Djibouti','JIB','1'),(40,'Abu Rudeis','AUE','1'),(41,'Abu Simbel','ABS','1'),(42,'Al Arish','AAC','1'),(43,'Al Arish','AAC','1'),(44,'Alexandria, El Nhouza Airport','ALY','1'),(45,'Assiut','ATZ','1'),(46,'Aswan, Daraw Airport','ASW','1'),(47,'Borg El Arab Airport','HBH','1'),(48,'Cairo Int\'l','CAI','1'),(49,'El Minya','EMY','1'),(50,'Hurghada Int\'l','HRG','1'),(51,'Kharga - New Valley','UVL','1'),(52,'Praia','RAI','1'),(56,'Annaba','AAE','1'),(57,'Constantine','CZL','1'),(58,'Oran (Ouahran)','ORN','1'),(59,'Bengueka','BUG','1'),(60,'Cabinda','CAB','1'),(61,'Luanda - 4 de Fevereiro','LAD','1'),(62,'Cotonou','COO','1'),(63,'Francistown','FRW','1'),(64,'Gaborone','GBE','1'),(65,'Maun','MUB','1'),(66,'Selibi Phikwe','PKW','1'),(67,'Bobo/Dioulasso','BOY','1'),(68,'Ouagadougou','OUA','1'),(69,'Sal','SID','1'),(70,'Bambari','BBY','1'),(71,'Bangassou','BGU','1'),(72,'Bangui','BGF','1'),(73,'Berberati','BBT','1'),(74,'Biraro','IRO','1'),(75,'Bria','BIV','1'),(76,'Carnot','CRF','1'),(77,'Ouadda','ODA','1'),(78,'Abeche','AEH','1'),(79,'Moundou','MQQ','1'),(80,'N\'Djamena','NDJ','1'),(81,'Anjouan','AJN','1'),(82,'Moroni - Prince Said Ibrahim','HAH','1'),(83,'Moroni - Iconi','YVA','1'),(84,'Brazzaville','BZV','1'),(85,'Pointe Noire','PNR','1'),(86,'Kinshasa - N\'Djili','FIH','1'),(87,'Lisala','LIQ','1'),(88,'Yamoussoukro','ASK','1'),(89,'Djibouti','JIB','1'),(90,'Abu Rudeis','AUE','1'),(91,'Abu Simbel','ABS','1'),(92,'Al Arish','AAC','1'),(93,'Al Arish','AAC','1'),(94,'Alexandria, El Nhouza Airport','ALY','1'),(95,'Assiut','ATZ','1'),(96,'Aswan, Daraw Airport','ASW','1'),(97,'Borg El Arab Airport','HBH','1'),(98,'Cairo Int\'l','CAI','1'),(99,'El Minya','EMY','1'),(100,'Hurghada Int\'l','HRG','1'),(101,'Kharga - New Valley','UVL','1'),(102,'Luxor','LXR','1'),(103,'Marsa Matrah (Marsa Matruh)','MUH','1'),(104,'New Valley - Kharga','UVL','1'),(105,'Port Said','PSD','1'),(106,'Santa Katarina - Mount Sinai','SKV','1'),(107,'Sharm El Sheikh','SSH','1'),(108,'Siwa','SEW','1'),(109,'Malabo','SSG','1'),(110,'Addis Ababa','ADD','1'),(111,'Lambarene','LBQ','1'),(112,'Libreville','LBV','1'),(113,'Moanda','MFF','1'),(114,'Mouila','MJL','1'),(115,'Mvengue','MVB','1'),(116,'Port Gentil','POG','1'),(117,'Oyem','UVE','1'),(118,'Banjul','BJL','1'),(119,'Accra','ACC','1'),(120,'Abidjan','ABJ','1'),(121,'Bouake','BYK','1'),(122,'Daloa','DJO','1'),(123,'Korhogo','HGO','1'),(124,'Man','MJC','1'),(125,'San Pedro','SPY','1'),(126,'Sassandra','ZSS','1'),(127,'Malindi','MYD','1'),(128,'Mombasa - Moi International','MBA','1'),(129,'Nairobi','NBO','1'),(130,'Maseru - Moshoeshoe Int\'l','MSU','1'),(131,'Monrovia','MLW','1'),(132,'Monrovia - Roberts Int\'l','ROB','1'),(133,'Bengasi','BEN','1'),(134,'Sehba','SEB','1'),(135,'Tripoli - Tripoli Int\'l','TIP','1'),(136,'Antananarivo (Tanannarive)','TNR','1'),(137,'Majunga','MJN','1'),(138,'Blantyre','BLZ','1'),(139,'Lilongwe - Lilongwe International','LLW','1'),(140,'Bamako','BKO','1'),(141,'Nouadhibou','NDB','1'),(142,'Nouakchott','NKC','1'),(143,'Zouerate','OUZ','1'),(144,'Dzaoudzi','DZA','1'),(145,'Agadir','AGA','1'),(146,'Al Hoceima','AHU','1'),(147,'Casablanca','CAS','1'),(148,'Casablanca, Mohamed V','CMN','1'),(149,'Fes','FEZ','1'),(150,'Marrakech - Menara','RAK','1'),(151,'Ouarzazate','OZZ','1'),(152,'Oujda','OUD','1'),(153,'Rabat - Sale','RBA','1'),(154,'Tanger - Boukhalef','TNG','1'),(155,'Beira','BEW','1'),(156,'Maputo - Maputo International','MPM','1'),(157,'Katima Mulilo/Mpacha','MPA','1'),(158,'Keetmanshoop','KMP','1'),(159,'Luederitz','LUD','1'),(160,'Mokuti','OKU','1'),(161,'Ondangwa','OND','1'),(162,'Oranjemund','OMD','1'),(163,'Rundu','NDU','1'),(164,'Swakopmund','SWP','1'),(165,'Tsumeb','TSB','1'),(166,'Windhoek - Eros','ERS','1'),(167,'Windhoek - Hosea Kutako Int\'l','WDH','1'),(168,'Agades','AJY','1'),(169,'Arlit','RLT','1'),(170,'Maradi','MFQ','1'),(171,'Niamey','NIM','1'),(172,'Zinder','ZND','1'),(173,'Abuja International','ABV','1'),(174,'Kano','KAN','1'),(175,'Lagos - Murtala Muhammed','LOS','1'),(176,'Port Harcourt','PHC','1'),(177,'Saint Denis de la Reunion','RUN','1'),(178,'Kigali - Gregoire Kayibanda','KGL','1'),(179,'Sao Tome','TMS','1'),(180,'Dakar','DKR','1'),(181,'Mahe - Seychelles Int\'l','SEZ','1'),(182,'Freetown','FNA','1'),(183,'Mogadischu','MGQ','1'),(186,'Alldays','ADY','1'),(190,'Ellisras','ELL','1'),(195,'Lusisiki','LUJ','1'),(197,'Messina','MEZ','1'),(198,'Mkambati','MBM','1'),(199,'Mzamba','MZF','1'),(200,'Nelspruit','NLP','1'),(206,'Pilanesberg/Sun City','NTY','1'),(214,'Thaba\'Nchu','TCU','1'),(218,'Vryheid','VYD','1'),(219,'Walvis Bay','WVB','1'),(220,'Welkom','WEL','1'),(221,'Kassala','KSL','1'),(222,'Khartoum','KRT','1'),(223,'Paramaribo - Zanderij Int\'l','PBM','1'),(224,'Manzini - Matsapha Int\'l','MTS','1'),(225,'Arusha','ARK','1'),(226,'Dar es Salam (Daressalam)','DAR','1'),(227,'Kilimadjaro','JRO','1'),(228,'Djerba','DJE','1'),(229,'Monastir','MIR','1'),(230,'Sfax','SFA','1'),(231,'Tunis - Carthage','TUN','1'),(232,'Entebbe','EBB','1'),(233,'Gulu','ULU','1'),(234,'Kisangani','FKI','1'),(235,'Lumbumbashi','FBM','1'),(236,'Chipata','CIP','1'),(237,'Kitwe','KIW','1'),(238,'Lusaka','LUN','1'),(239,'Mfuwe','MFU','1'),(240,'N\'Dola','NLA','1'),(241,'Buffalo Range','BFO','1'),(242,'Bulawayo','BUQ','1'),(243,'Gweru','GWE','1'),(244,'Harare','HRE','1'),(245,'Hwange National Park','HWN','1'),(246,'Masvingo','MVZ','1'),(247,'Salisbury','SAY','1'),(248,'Victoria Falls','VFA','1'),(249,'Sapporo','SPK','1'),(250,'Sapporo - Okadama','OKD','1'),(251,'Hong Kong - Int\'l Airport (HKIA)','HKG','1'),(252,'Kobe','UKB','1'),(253,'Kyoto','UKY','1'),(254,'Nagoya - Komaki AFB','NGO','1'),(255,'Tokyo','TYO','1'),(256,'Tokyo - Haneda','HND','1'),(257,'Tokyo - Narita','NRT','1'),(258,'Male - International','MLE','1'),(259,'Kathmandu - Tribhuvan','KTM','1'),(260,'Seoul - Incheon Int\'l Airport','ICN','1'),(261,'Seoul - Kimpo','SEL','1'),(262,'Colombo','CMB','1'),(263,'Barisal','BZL','1'),(264,'Chittagong','CGP','1'),(265,'Dhaka','DAC','1'),(266,'Sylhet','ZYL','1'),(267,'Paro','PBH','1'),(268,'Beijing','PEK','1'),(269,'Beijing - Nanyuan Airport','NAY','1'),(270,'Shanghai - Hongqiao','SHA','1'),(271,'Shanghai - Pu Dong','PVG','1'),(272,'Tianjin','TSN','1'),(273,'Xiamen','XMN','1'),(274,'Dongguan','DGM','1'),(275,'Guangzhou (Canton) - Baiyun (White Cloud)','CAN','1'),(276,'Shenzhen','SZX','1'),(277,'Nanning','NNG','1'),(278,'Harbin (Haerbin)','HRB','1'),(279,'Hong Kong - Chek Lap Kok','ZJK','1'),(280,'Wuhan','WUH','1'),(281,'Ahmedabad','AMD','1'),(282,'Amritsar','ATQ','1'),(283,'Anand','QNB','1'),(284,'Bagdogra','IXB','1'),(285,'Bangalore','BLR','1'),(286,'Baronda','BDQ','1'),(287,'Belgaum','IXG','1'),(288,'Bhopal','BHO','1'),(289,'Bhubaneswar','BBI','1'),(290,'Bombay','BOM','1'),(291,'Calcutta (Kolkata) - Netaji Subhas Chandra','CCU','1'),(292,'Calicut','CCJ','1'),(293,'Chandigarh','IXC','1'),(294,'Chennai (Madras)','MAA','1'),(295,'Cochin','COK','1'),(296,'Coimbatore','CJB','1'),(297,'Delhi, Indira Gandhi','DEL','1'),(298,'Goa','GOI','1'),(299,'Guwahati','GAU','1'),(300,'Hyderabad - Begumpet','HYD','1'),(301,'Jaipur - Sanganeer','JAI','1'),(302,'Jalandhar','JLR','1'),(303,'Jamshedpur - Sonari','IXW','1'),(304,'Kanpur','QJU','1'),(305,'Kolkata (Calcutta) - Netaji Subhas Chandra','CCU','1'),(306,'Lucknow','LKO','1'),(308,'Nagpur','NAG','1'),(309,'Patna','PAT','1'),(310,'Pune','PNQ','1'),(311,'Rajkot','RAJ','1'),(312,'Ranchi','IXR','1'),(313,'Srinagar','SXR','1'),(314,'Surat','STV','1'),(315,'Thiruvananthapuram','TRV','1'),(316,'Tiruchirapally','TRZ','1'),(317,'Varanasi','VNS','1'),(318,'Akita','AXT','1'),(319,'Amami','ASJ','1'),(320,'Aomori','AOJ','1'),(321,'Komatsu','KMQ','1'),(322,'Chiba City','QCB','1'),(323,'Chitose','CTS','1'),(324,'Fukuoka','FUK','1'),(325,'Fukushima-shi, Fukushima Airport','FKS','1'),(326,'Hachijo Jima','HAC','1'),(327,'Hakodate','HKD','1'),(328,'Hiroshima International','HIJ','1'),(329,'Ishigaki','LSG','1'),(330,'Kagoshima','KOJ','1'),(331,'Kochi','KCZ','1'),(332,'Kumamoto','KMJ','1'),(333,'Kushiro','KUH','1'),(334,'Matsumoto, Nagano','MMJ','1'),(335,'Matsuyama','MYJ','1'),(336,'Miyako Jima (Ryuku Islands) - Hirara','MMY','1'),(337,'Morioka, Hanamaki','HNA','1'),(338,'Miyazaki','KMI','1'),(339,'Nagasaki','NGS','1'),(340,'Niigata','KIJ','1'),(341,'Oita','OIT','1'),(342,'Okayama','OKJ','1'),(343,'Okinawa, Ryukyo Island - Naha','OKA','1'),(344,'Osaka, Metropolitan Area','OSA','1'),(345,'Osaka - Itami','ITM','1'),(346,'Osaka - Kansai Int\'l Airport','KIX','1'),(347,'Sado Shima','SDS','1'),(348,'Sapporo - Shin-Chitose Airport','CTS','1'),(349,'Sendai','SDJ','1'),(350,'Takamatsu','TAK','1'),(351,'Tokushima','TKS','1'),(352,'Toyama','TOY','1'),(353,'Yamagata, Junmachi','GAJ','1'),(354,'Yokohama','YOK','1'),(355,'Changchun','CGQ','1'),(356,'Aktyubinsk','ADX','1'),(357,'Alma Ata','ALA','1'),(358,'Astana','TSE','1'),(359,'Incheon, Incheon Int\'l Airport','ICN','1'),(360,'Dalian','DLC','1'),(361,'Shenyang','SHE','1'),(362,'Macau','MFM','1'),(363,'Mauritius - S.Seewoosagur Ram Int\'l','MRU','1'),(364,'Rodrigues Island','RRG','1'),(365,'Ulaanbaatar - Buyant Uhaa','ULN','1'),(366,'Xi\'an - Xianyang','XIY','1'),(367,'Jinan','TNA','1'),(368,'Qingdao','TAO','1'),(369,'Taiyuan','TYN','1'),(370,'Chengdu','CTU','1'),(371,'Chongqing','CKG','1'),(372,'Singapore - Paya Lebar','QPG','1'),(373,'Singapore - Changi','SIN','1'),(374,'Pu San (Pusan) - Kimhae','PUS','1'),(375,'Dushanbe (Duschanbe)','DYU','1'),(376,'Kaohsiung Int\'l','KHH','1'),(377,'Makung','MZG','1'),(378,'Taipei - Chiang Kai Shek','TPE','1'),(379,'Taipei - Sung Shan','TAY','1'),(380,'Samarkand','SKD','1'),(381,'Tashkent - Vostochny','TAS','1'),(382,'Termez (Termes)','TMZ','1'),(383,'Urumqi','URC','1'),(384,'Hangchow (Hangzhou)','HGH','1'),(385,'Pointe a Pitre','PTP','1'),(386,'Bonaire','BON','1'),(387,'Curacao','CUR','1'),(388,'St. Marteen','SXM','1'),(389,'Nevis','NEV','1'),(390,'St. Kitts','SKB','1'),(391,'St. Lucia Hewanorra','UVF','1'),(392,'St. Lucia Vigle','SLU','1'),(393,'St. Martin','SFG','1'),(394,'St. Vincent','SVD','1'),(395,'Havana - Jos Mart Int\'l','HAV','1'),(396,'Holguin','HOG','1'),(397,'Santiago - Antonio Maceo Airport','SCU','1'),(398,'Varadero','VRA','1'),(399,'Casa de Campo/La Romana','LRM','1'),(400,'Puerto Plata','POP','1'),(401,'Punta Cana','PUJ','1'),(402,'Santo Domingo','SDQ','1'),(403,'Port au Prince','PAP','1'),(404,'Kingston - Norman Manley','KIN','1'),(405,'Montenego Bay','MBJ','1'),(406,'Fort de France','FDF','1'),(407,'Aguadilla','BQN','1'),(408,'Mayaguez','MAZ','1'),(409,'Ponce','PSE','1'),(410,'San Juan Perto','SJU','1'),(411,'Tobago','TAB','1'),(412,'Port of Spain','POS','1'),(413,'St. Croix','STX','1'),(414,'St. Thomas','STT','1'),(415,'Tortola','EIS','1'),(416,'Virgin Gorda','VIJ','1'),(417,'Beef Island','EIS','1'),(418,'Freeport','FPO','1'),(419,'Nassau','NAS','1'),(420,'Grand Cayman','GCM','1'),(421,'Anguilla','AXA','1'),(422,'Antigua','ANU','1'),(423,'Aruba','AUA','1'),(424,'Chub Cay','CCZ','1'),(425,'Govenors Harbour','GHB','1'),(426,'Grand Bahama','GBI','1'),(427,'Marsh Harbour','MHH','1'),(428,'North Eleuthera','ELH','1'),(429,'Rock Sound','RSD','1'),(430,'San Salvador','ZSA','1'),(431,'Treasure Cay','TCB','1'),(432,'Bridgetown, Grantley Adams Int\'l','BGI','1'),(433,'Bermuda','BDA','1'),(434,'Panama City - Tocumen International','PTY','1'),(435,'San Jose','SJO','1'),(436,'San Salvador','SAL','1'),(437,'Roatan','RTB','1'),(438,'San Pedro Sula','SAP','1'),(439,'Santa Rosa Copan','SDH','1'),(440,'Tegucigalpa','TGU','1'),(441,'Belize City','BZE','1'),(442,'Guatemala City','GUA','1'),(443,'Managua - Augusto C Sandino','MGA','1'),(444,'Sarajevo','SJJ','1'),(445,'Sofia - Vrazhdebna','SOF','1'),(446,'Nadi','NAN','1'),(447,'Suva/Nausori','SUV','1'),(448,'Nausori','SUV','1'),(449,'Budapest, Ferihegy','BUD','1'),(450,'Skopje','SKP','1'),(451,'Bucharest','BUH','1'),(452,'Bucharest, Otopeni','OTP','1'),(453,'Eriwan (Yerevan, Jerevan)','EVN','1'),(454,'Baku','BAK','1'),(455,'Minsk, International','MSQ','1'),(456,'Mostar','OMO','1'),(457,'Bourgas/Burgas','BOJ','1'),(458,'Gorna','GOZ','1'),(459,'Ruse','ROU','1'),(460,'Silistra','SLS','1'),(461,'Targovishte','TGV','1'),(462,'Varna','VAR','1'),(463,'Vidin','VID','1'),(464,'Dubrovnik','DBV','1'),(465,'(Mali) Losinj - Losinj Arpt','LSZ','1'),(466,'Osijek','OSI','1'),(467,'Pula','PUY','1'),(468,'Rijeka','RJK','1'),(469,'Split','SPU','1'),(470,'Zadar','ZAD','1'),(471,'Zagreb - Pleso','ZAG','1'),(472,'Tallinn - Pirita Harbour','QUF','1'),(473,'Tallinn - Ulemiste','TLL','1'),(474,'Tbilisi - Novo Alexeyevka','TBS','1'),(475,'Riga','RIX','1'),(476,'Wilna (Vilnius)','VNO','1'),(477,'Ohrid','OHD','1'),(478,'Constanza','CND','1'),(479,'Adler/Sochi','AER','1'),(480,'Chabarovsk (Khabarovsk)','KHV','1'),(481,'Chita (Tschita)','HTA','1'),(482,'Irkutsk','IKT','1'),(483,'Kazan (Ka San)','KZN','1'),(484,'Mineralnye Vody','MRV','1'),(485,'Moscow - Metropolitan Area','MOW','1'),(486,'Moscow - Domodedovo','DME','1'),(487,'Moscow - Sheremetyevo','SVO','1'),(488,'Moscow - Vnukovo','VKO','1'),(489,'Murmansk','MMK','1'),(490,'Novosibirsk - Tolmachevo','OVB','1'),(491,'St. Petersburg (Leningrad) - Pulkovo','LED','1'),(492,'Ulan-Ude','UUD','1'),(493,'Velikiye Luki (Welikije Luki)','VLU','1'),(494,'Arkhangelsk','ARH','1'),(495,'Yakutsk','YKS','1'),(496,'Bratislava','BTS','1'),(497,'Ljubljana - Brnik','LJU','1'),(498,'Maribor','MBX','1'),(499,'Kiev - Borispol','KBP','1'),(500,'Kiev - Zhulhany','IEV','1'),(501,'Lvov (Lwow, Lemberg)','LWO','1'),(502,'Nikolaev','NLV','1'),(503,'Odessa','ODS','1'),(504,'Simferopol','SIP','1'),(505,'Belgrad (Beograd)','BEG','1'),(506,'Nis','INI','1'),(507,'Novi Sad','QND','1'),(508,'Podgorica','TGD','1'),(509,'Pristina','PRN','1'),(510,'Tivat','TIV','1'),(511,'Tirana - Rinas','TIA','1'),(512,'Innsbruck - Kranebitten','INN','1'),(513,'Salzburg - W.A. Mozart','SZG','1'),(514,'Wien (Vienna) - Vienna Int\'l','VIE','1'),(515,'Copenhagen','CPH','1'),(516,'Helsinki - Vantaa','HEL','1'),(517,'Berlin','BER','1'),(518,'Berlin, Schoenefeld','SXF','1'),(519,'Berlin, Tegel','TXL','1'),(520,'Dresden','DRS','1'),(521,'Hamburg - Fuhlsbuettel','HAM','1'),(522,'Athens','ATH','1'),(523,'Athens, Hellinikon Airport','HEW','1'),(524,'Corfu','CFU','1'),(525,'Kos','KGS','1'),(526,'Mykonos','JMK','1'),(527,'Mytilene (Lesbos)','MJT','1'),(528,'Rhodos','RHO','1'),(529,'Thessaloniki - Makedonia Apt.','SKG','1'),(530,'Ibiza','IBZ','1'),(531,'Cork','ORK','1'),(532,'Dublin','DUB','1'),(533,'Galway','GWY','1'),(534,'Kerry County','KIR','1'),(535,'Knock','NOC','1'),(536,'Shannon (Limerick)','SNN','1'),(537,'Cagliari','CAG','1'),(538,'Luga','MLA','1'),(539,'Bergen','BGO','1'),(540,'Oslo','OSL','1'),(541,'Oslo - Sandefjord','TRF','1'),(542,'Krakau','KRK','1'),(543,'Warsaw','WAW','1'),(544,'Lisbon - Lisboa','LIS','1'),(545,'Ponta Delgada','PDL','1'),(546,'Palma de Mallorca','PMI','1'),(547,'Sevilla','SVQ','1'),(548,'Valencia','VLC','1'),(549,'Goteborg','GOT','1'),(550,'Stockholm Metropolitan Area','STO','1'),(551,'Stockholm - Arlanda','ARN','1'),(552,'Stockholm - Bromma','BMA','1'),(553,'Belfast - Harbour','BHD','1'),(554,'Belfast International','BFS','1'),(555,'Glasgow, Prestwick','PIK','1'),(556,'Glasgow','GLA','1'),(557,'Inverness','INV','1'),(558,'Andorra La Vella H/P','ALV','1'),(559,'Graz','GRZ','1'),(560,'Klagenfurt','KLU','1'),(561,'Linz - Hoersching','LNZ','1'),(562,'Antwerp','ANR','1'),(563,'Brussels','BRU','1'),(564,'Liege','LGG','1'),(565,'Akrotiri - RAF','AKT','1'),(566,'Larnaca','LCA','1'),(567,'Limassol','QLI','1'),(568,'Nicosia','NIC','1'),(569,'Paphos','PFO','1'),(570,'Prague - Ruzyne','PRG','1'),(571,'Aarhus','AAR','1'),(572,'Alborg','AAL','1'),(573,'Billund','BLL','1'),(574,'Esbjerg','EBJ','1'),(575,'Faroer','FAE','1'),(576,'Karup','KRP','1'),(577,'Odense','ODE','1'),(578,'Roenne','RNN','1'),(579,'Skrydstrup','SKS','1'),(580,'Soenderborg','SGD','1'),(581,'Thisted','TED','1'),(582,'Enontekioe','ENF','1'),(583,'Ivalo','IVL','1'),(584,'Joensuu','JOE','1'),(585,'Jyvaeskylae','JYV','1'),(586,'Kajaani','KAJ','1'),(587,'Kauhajoki','KHJ','1'),(588,'Kemi/Tornio','KEM','1'),(589,'Kittil','KTT','1'),(590,'Kokkola/Pietarsaari','KOK','1'),(591,'Kuopio','KUO','1'),(592,'Kuusamo','KAO','1'),(593,'Lappeenranta','LPP','1'),(594,'Mariehamn (Maarianhamina)','MHQ','1'),(595,'Mikkeli','MIK','1'),(596,'Oulu','OUL','1'),(597,'Pori','POR','1'),(598,'Rovaniemi','RVN','1'),(599,'Savonlinna','SVL','1'),(600,'Seinaejoki','SJY','1'),(601,'Sodankylae','SOT','1'),(602,'Tampere','TMP','1'),(603,'Turku','TKU','1'),(604,'Vaasa','VAA','1'),(605,'Varkaus','VRK','1'),(606,'Ajaccio','AJA','1'),(607,'Albi','LBI','1'),(608,'Annecy','NCY','1'),(609,'Aurillac','AUR','1'),(610,'Bastia','BIA','1'),(611,'Biarritz','BIQ','1'),(612,'Bordeaux','BOD','1'),(613,'Brest','BES','1'),(614,'Calvi','CLY','1'),(615,'Chambery','CMF','1'),(616,'Clermont Ferrand','CFE','1'),(617,'Dinard','DNR','1'),(618,'Figari','FSC','1'),(619,'Frejus','FRJ','1'),(620,'Grenoble','GNB','1'),(621,'La Rochelle','LRH','1'),(622,'Lannion','LAI','1'),(623,'Lille','LIL','1'),(624,'Limoges','LIG','1'),(625,'Lorient','LRT','1'),(626,'Lourdes/Tarbes','LDE','1'),(627,'Lyon','LYS','1'),(628,'Marseille','MRS','1'),(629,'Metz','MZM','1'),(630,'Montpellier - Frejorgues','MPL','1'),(631,'Mulhouse','MLH','1'),(632,'Nancy','ENC','1'),(633,'Nantes','NTE','1'),(634,'Nice - Cote D\'Azur','NCE','1'),(635,'Nimes','FNI','1'),(636,'Paris','PAR','1'),(637,'Paris - Charles de Gaulle','CDG','1'),(638,'Paris - Le Bourget','LBG','1'),(639,'Paris - Orly','ORY','1'),(640,'Pau','PUF','1'),(641,'Perpignan','PGF','1'),(642,'Quimper','UIP','1'),(643,'Rennes','RNS','1'),(644,'Roanne','RNE','1'),(645,'Rodez','RDZ','1'),(646,'Saint Brieuc','SBK','1'),(647,'St. Etienne','EBU','1'),(648,'Strassburg','SXB','1'),(649,'Toulouse - Blagnac','TLS','1'),(650,'Augsburg','AGB','1'),(651,'Bayreuth','BYU','1'),(652,'Bremen','BRE','1'),(653,'Cologne (Koeln)/Bonn','CGN','1'),(654,'Dortmund','DTM','1'),(655,'Duesseldorf','DUS','1'),(656,'Erfurt','ERF','1'),(657,'Frankfurt/Main Int\'l Airport','FRA','1'),(658,'Frankfurt/Hahn','HNN','1'),(659,'Friedrichshafen','FDH','1'),(660,'Hannover','HAJ','1'),(661,'Hof','HOQ','1'),(662,'Karlsruhe-Baden - Soellingen','FKB','1'),(663,'Kiel - Holtenau','KEL','1'),(664,'Kln, Kln/Bonn','CGN','1'),(665,'Leipzig','LEJ','1'),(666,'Muenchen (Munich) - Franz Josef Strauss','MUC','1'),(667,'Muenster/Osnabrueck','FMO','1'),(668,'Muenster/Osnabrueck','MSR','1'),(669,'Nrnberg (Nuremberg)','NUE','1'),(670,'Paderborn/Lippstadt','PAD','1'),(671,'Saarbruecken','SCN','1'),(672,'Stuttgart - Echterdingen','STR','1'),(673,'Westerland','GWT','1'),(674,'Wiesbaden, Air Base','WIE','1'),(675,'Gibraltar','GIB','1'),(676,'Araxos','GPA','1'),(677,'Chania','CHQ','1'),(678,'Chios','JKH','1'),(679,'Heraklion','HER','1'),(680,'Kalamata','KLX','1'),(681,'Karpathos','AOK','1'),(682,'Kavalla','KVA','1'),(683,'Preveza/Lefkas','PVK','1'),(684,'Saloniki','SKG','1'),(685,'Samos','SMI','1'),(686,'Skiathos','JSI','1'),(687,'Thira','JTR','1'),(688,'Zakynthos','ZTH','1'),(689,'Christmas Line','CXI','1'),(690,'Egilsstadir','EGS','1'),(691,'Reykjavik - Metropolitan Area','REK','1'),(692,'Reykjavik - Keflavik International','KEF','1'),(693,'Sligo','SXL','1'),(694,'Alghero Sassari','AHO','1'),(695,'Ancona','AOI','1'),(696,'Bari','BRI','1'),(697,'Bergamo','BGY','1'),(698,'Bologna','BLQ','1'),(699,'Brescia, Montichiari','VBS','1'),(700,'Brindisi','BDS','1'),(701,'Catania','CTA','1'),(702,'Florence','FLR','1'),(703,'Genoa','GOA','1'),(704,'Lamezia Terme','SUF','1'),(705,'Lampedusa','LMP','1'),(706,'Milan','MIL','1'),(707,'Milan - Linate','LIN','1'),(708,'Milan - Malpensa','MXP','1'),(709,'Milan - Orio Al Serio','BGY','1'),(710,'Naples','NAP','1'),(711,'Olbia','OLB','1'),(712,'Palermo - Punta Raisi','PMO','1'),(713,'Pantelleria','PNL','1'),(714,'Perugia','PEG','1'),(715,'Pescara','PSR','1'),(716,'Pisa - Gal Galilei','PSA','1'),(717,'Reggio Calabria','REG','1'),(718,'Rimini','RMI','1'),(719,'Rome','ROM','1'),(720,'Rome - Ciampino','CIA','1'),(721,'Rome - Fuimicino','FCO','1'),(722,'Trapani','TPS','1'),(723,'Treviso','TSF','1'),(724,'Trieste','TRS','1'),(725,'Turin','TRN','1'),(726,'Venice - Marco Polo','VCE','1'),(727,'Verona (Brescia) Montichiari','VBS','1'),(728,'Verona','VRN','1'),(729,'Luxembourg','LUX','1'),(730,'Amsterdam, Schiphol','AMS','1'),(731,'Den Haag (The Hague)','HAG','1'),(732,'Eindhoven','EIN','1'),(733,'Lelystad','LEY','1'),(734,'Maastricht/Aachen','MST','1'),(735,'Rotterdam','RTM','1'),(736,'Alesund','AES','1'),(737,'Alta','ALF','1'),(738,'Bardufoss','BDU','1'),(739,'Bodo','BOO','1'),(740,'Broennoeysund','BNN','1'),(741,'Evenes','EVE','1'),(742,'Floro','FRO','1'),(743,'Hammerfest','HFT','1'),(744,'Haugesund','HAU','1'),(745,'Kirkenes','KKN','1'),(746,'Kristiansand','KRS','1'),(747,'Kristiansund','KSU','1'),(748,'Lakselv','LKL','1'),(749,'Sogndal','SOG','1'),(750,'Stavanger','SVG','1'),(751,'Tromsoe','TOS','1'),(752,'Trondheim','TRD','1'),(753,'Gdansk','GDN','1'),(754,'Poznan, Lawica','POZ','1'),(755,'Stettin','SZZ','1'),(756,'Faro','FAO','1'),(757,'Funchal','FNC','1'),(758,'Horta','HOR','1'),(759,'Porto','OPO','1'),(760,'Porto Santo','PXO','1'),(761,'Santa Maria','SMA','1'),(762,'Terceira','TER','1'),(763,'Alicante','ALC','1'),(764,'Almeria','LEI','1'),(765,'Arrecife/Lanzarote','ACE','1'),(766,'Badajoz','BJZ','1'),(767,'Barcelona','BCN','1'),(768,'Bilbao','BIO','1'),(769,'Cordoba','ODB','1'),(770,'Fuerteventura','FUE','1'),(771,'Gerona','GRO','1'),(772,'Granada','GRX','1'),(773,'Jerez de la Frontera/Cadiz','XRY','1'),(774,'La Coruna','LCG','1'),(775,'Las Palmas','LPA','1'),(776,'Madrid - Barajas','MAD','1'),(777,'Mahon','MAH','1'),(778,'Malaga','AGP','1'),(779,'Murcia','MJV','1'),(780,'Oviedo','OVD','1'),(781,'Reus','REU','1'),(782,'San Sebastian','EAS','1'),(783,'Santa Cruz de la Palma','SPC','1'),(784,'Santander','SDR','1'),(785,'Santiago de Compostela','SCQ','1'),(786,'Tenerife','TCI','1'),(787,'Tenerife - Sur Reina Sofia','TFS','1'),(788,'Tenerife - Norte Los Rodeos','TFN','1'),(789,'Valladolid','VLL','1'),(790,'Valverde','VDE','1'),(791,'Vigo','VGO','1'),(792,'Vitoria','VIT','1'),(793,'Zaragoza','ZAZ','1'),(794,'Longyearbyen - Svalbard','LYR','1'),(795,'Helsingborg','JHE','1'),(796,'Joenkoeping','JKG','1'),(797,'Kalmar','KLR','1'),(798,'Karlstad','KSD','1'),(799,'Kiruna','KRN','1'),(800,'Kristianstad','KID','1'),(801,'Lidkoeping','LDK','1'),(802,'Lulea','LLA','1'),(803,'Malmo (Malmoe)','MMA','1'),(804,'Malmo (Malmoe) - Sturup','MMX','1'),(805,'Norrkoeping','NRK','1'),(806,'Oerebro','ORB','1'),(807,'Ronneby','RNB','1'),(808,'Sundsvall','SDL','1'),(809,'Vaexjoe','VXO','1'),(810,'Vasteras','VST','1'),(811,'Visby','VBY','1'),(812,'Altenrhein','ACH','1'),(813,'Basel','BSL','1'),(814,'Bern','BRN','1'),(815,'Bern','ZDJ','1'),(816,'Geneva','GVA','1'),(817,'Lugano','LUG','1'),(818,'Zurich (Zrich) - Kloten','ZRH','1'),(819,'Basel/Mulhouse','EAP','1'),(820,'Los Rodeos','TFN','1'),(821,'Reina Sofia','TFS','1'),(822,'Sheffield, City Airport','SZD','1'),(823,'Aberdeen','ABZ','1'),(824,'Birmingham','BHX','1'),(825,'Bristol','BRS','1'),(826,'Cambrigde','CBG','1'),(827,'Cardiff','CWL','1'),(828,'Derby (East Midlands)','EMA','1'),(829,'Derry (Londonderry)','LDY','1'),(830,'Edinburgh','EDI','1'),(831,'Guernsey','GCI','1'),(832,'Humberside','HUY','1'),(833,'Isle of Man','IOM','1'),(834,'Jersey','JER','1'),(835,'Leeds/Bradford','LBA','1'),(836,'Liverpool','LPL','1'),(837,'London','LON','1'),(838,'London - City Airport','LCY','1'),(839,'London - Gatwick','LGW','1'),(840,'London - Heathrow','LHR','1'),(841,'London - Luton','LTN','1'),(842,'London - Stansted','STN','1'),(843,'Manchester','MAN','1'),(844,'Newcastle','NCL','1'),(845,'Orkney','KOI','1'),(846,'Southampton - Eastleigh','SOU','1'),(847,'Southend','SEN','1'),(848,'Stansted (London)','STN','1'),(849,'Stornway','SYY','1'),(850,'Sumburgh (Shetland)','LSI','1'),(851,'Teesside, Durham Tees Valley','MME','1'),(852,'Wick','WIC','1'),(853,'Jerusalem','JRS','1'),(854,'Tel Aviv - Ben Gurion Int\'l','TLV','1'),(855,'Beirut','BEY','1'),(856,'Istanbul - Ataturk','IST','1'),(857,'Izmir','IZM','1'),(858,'Kabul - Khwaja Rawash','KBL','1'),(859,'Bahrain','BAH','1'),(860,'Abadan','ABD','1'),(861,'Tehran (Teheran) - Mehrabad','THR','1'),(862,'Bagdad, Al Muthana','BGW','1'),(863,'Bagdad, Saddam International','SDA','1'),(864,'Basra, Basrah','BSR','1'),(865,'Kirkuk','KIK','1'),(866,'Mosul','OSM','1'),(867,'Elat','ETH','1'),(868,'Elat, Ovula','VDA','1'),(869,'Haifa','HFA','1'),(870,'Amman, Queen Alia Intl','AMM','1'),(871,'Amman, Civil - Marka Airport','ADJ','1'),(872,'Aqaba','AQJ','1'),(873,'Kuwait - Kuwait Int\'l','KWI','1'),(874,'Jounieh','GJN','1'),(875,'Muscat - Seeb','MCT','1'),(876,'Salalah','SLL','1'),(877,'Bahawalpur','BHV','1'),(878,'Bannu','BNP','1'),(879,'Chitral','CJL','1'),(880,'Dera Ismail Khan','DSK','1'),(881,'Faisalabad','LYP','1'),(882,'Gilgit','GIL','1'),(883,'Gwadar','GWD','1'),(884,'Hyderabad','HDD','1'),(885,'Islamabad - Islamabad Int\'l','ISB','1'),(886,'Jacobabad','JAG','1'),(887,'Jiwani','JIW','1'),(888,'Karachi - Quaid-E-Azam Int\'l','KHI','1'),(889,'Khuzdar','KDD','1'),(890,'Kohat','OHT','1'),(891,'Lahore','LHE','1'),(892,'Mianwali','MWD','1'),(893,'Mirpur','QML','1'),(894,'Moenjodaro','MJD','1'),(895,'Multan','MUX','1'),(896,'Muzaffarabad','MFG','1'),(897,'Nawab Shah','WNS','1'),(898,'Panjgur','PJG','1'),(899,'Pasni','PSI','1'),(900,'Peshawar','PEW','1'),(901,'Quetta','UET','1'),(902,'Rahim Yar Khan','RYK','1'),(903,'Rawala Kot','RAZ','1'),(904,'Rawalpindi','RWP','1'),(905,'Saidu Sharif','SDT','1'),(906,'Sindhri','MPD','1'),(907,'Skardu','KDU','1'),(908,'Sui','SUL','1'),(909,'Sukkur','SKZ','1'),(910,'Turbat','TUK','1'),(911,'Zhob','PZH','1'),(912,'Doha','DOH','1'),(913,'Adana','ADA','1'),(914,'Ankara','ANK','1'),(915,'Antalya','AYT','1'),(916,'Dalaman','DLM','1'),(917,'Ashgabat, Ashkhabat','ASB','1'),(918,'Abu Dhabi','AUH','1'),(919,'Alfujairah (Fujairah)','FJR','1'),(920,'Dubai','DXB','1'),(921,'Ras al Khaymah (Ras al Khaimah)','RKT','1'),(922,'Sharjah','SHJ','1'),(923,'Al Ain','AAN','1'),(924,'Fujairah, Int\'l Airport','FJR','1'),(925,'Dhahran','DHA','1'),(926,'Jeddah - King Abdulaziz Int\'l','JED','1'),(927,'Khamis Mushayat','AHB','1'),(928,'Madinah, Mohammad Bin Abdulaziz','MED','1'),(929,'Medina','MED','1'),(930,'Riyadh - King Khaled Int\'l','RUH','1'),(931,'Tabuk','TUU','1'),(932,'Taif','TIF','1'),(933,'Yanbu','YNB','1'),(934,'Dammam, King Fahad Int\'l','DMM','1'),(935,'Aleppo','ALP','1'),(936,'Damascus, International','DAM','1'),(937,'Aden','ADE','1'),(938,'Sanaa (Sana\'a) - Sana\'a International','SAH','1'),(939,'Attawapiskat, NT','YAT','1'),(940,'Bonaventure, PQ','YVB','1'),(941,'Calgary/Banff','YYC','1'),(942,'Cambridge Bay','YCB','1'),(943,'Churchill','YYQ','1'),(944,'Cienfuegos','CFG','1'),(945,'Deer Lake/Corner Brook','YDF','1'),(946,'Edmonton','YEA','1'),(947,'Edmonton, International','YEG','1'),(948,'Edmonton, Municipal','YXD','1'),(949,'Flin Flon','YFO','1'),(950,'Fort